code,url,titre,contenu,langue,nb_caracteres,nb_mots,date_publication,lieu,maladie,animal,source_publication,resume_50_mots,resume_100_mots,resume_150_mots,maladie_normalisee
code151,https://lc.cx/nKVbsM,Le virus de la fièvre catarrhale a été détecté en Europe,"Tridge LogoPlateforme de trading mondiale Tridge Obtenez une démo Connectez-vous Actualités Le virus de la fièvre catarrhale a été détecté en Europe Viande d'agneau Belgique Autres politiques Allemagne +6 Publié le 16 octobre 2023 Résumé de Tridge Le virus de la fièvre catarrhale a été détecté en Allemagne après avoir été précédemment trouvé aux Pays-Bas et en Belgique. Le virus a été diagnostiqué chez un mouton dans une ferme près de la frontière néerlandaise, ce qui a conduit à des mesures de quarantaine. Le virus, qui touche principalement les bovins, les ovins et les caprins, est propagé par les moucherons et provoque de graves symptômes chez les ovins. Avertissement : le résumé ci-dessus a été généré par le modèle d'IA exclusif de Tridge à des fins d'information. Contenu original Après les Pays-Bas et la Belgique, le virus de la fièvre catarrhale a également été détecté en Allemagne. Les autorités compétentes ont diagnostiqué la maladie chez un mouton dans une ferme proche de la frontière néerlandaise. Selon les tests, les autres animaux de la ferme ne présentent aucun signe de maladie, malgré cela, une quarantaine a été ordonnée. La maladie provoque de graves dommages économiques dans la région, car la Rhénanie du Nord-Westphalie perd son statut indemne de maladie, ce qui entraîne des restrictions commerciales concernant les espèces animales sensibles à la fièvre catarrhale du mouton. Les premiers cas de la vague actuelle ont été détectés en août dans des élevages ovins en Espagne, puis découverts par les autorités néerlandaises début septembre. Généralement, la présence du virus a été détectée dans les élevages de moutons et aujourd'hui, près de 40 élevages sont touchés en Hollande du Nord et dans la province d'Utrecht. Toutefois, des animaux ont déjà été testés positifs au virus dans certains élevages de bovins. Le virus de sérotype 3 est responsable de la maladie dans la région, qui produit... Source : Agraragazat Vous souhaitez des informations plus approfondies ? Accédez à une analyse de marché détaillée adaptée aux besoins de votre entreprise. Contactez-nous pour en savoir plus Données de marché connexes Curation mars 2025 Marché d'exportation de la coupe de bœuf congelé avec os aux Pays-Bas 25 données sur les prix à l'exportation Curation mars 2024 Marché d'exportation de la coupe de bœuf congelé avec os en Espagne 20 données sur les prix à l'exportation À lire ensuite Actualités Marchés mondiaux des céréales et des oléagineux Oilworld 5 décembre 2025 Actualités Les exportations mondiales d'huile de palme rebondissent après une faiblesse en 2024 UkrAgroConsult 4 décembre 2025 Actualités Le nombre de sangliers testés positifs à la peste porcine africaine en Catalogne s'élève à 13. Agrodiario 5 décembre 2025 Actualités L'UE assouplit les règles pour les plantes créées par modification génétique UkrAgroConsult 4 décembre 2025 Actualités L'UZAG prévoit la récolte de céréales et d'oléagineux en 2025 à un niveau de 81,4 millions de tonnes. Oilworld 5 décembre 2025 Lire le contenu plus pertinent Rapport Rapport de perspectives de septembre 2025 : Café, sucre, thé et cacao Victor Langat 26 septembre 2025 Rapport Rapport de perspectives de septembre 2025 : Viande Victor Langat 26 septembre 2025 Opinion Le marché américain des pommes fait face à une récolte record et à des vents contraires croissants Bojan Mijatovic 5 septembre 2025 Opinion Les mandarines Tango de l'Équateur font leurs débuts aux États-Unis après Négociation quinquennale Bojan Mijatovic 29 août 2025 Opinion Impact du typhon Kajiki sur l'agriculture vietnamienne : pertes localisées de riz, perturbation limitée du café Mzingaye Ndubiwa 28 août 2025 Opinion Impact des tarifs américains sur l'agriculture de l'UE : impacts sectoriels et réponses stratégiques Benjamin Lategan 22 août 2025 Opinion Les tarifs américains sur les fruits de mer brésiliens se répercutent à travers la chaîne d'approvisionnement Bojan Mijatovic Rapport du 22 août 2025 Rapport Outlook d'août 2025 : Huiles Xchel Perez 22 août 2025 Logo TridgePlateforme de trading mondiale Tridge Accueil de Tridge À propos de Tridge Centre d'aide Carrières Contactez-nous 2025 Tridge. Tous droits réservés. Toutes les données et analyses sont la propriété de Tridge. La reproduction, la distribution, la modification ou l'utilisation commerciale sans autorisation sont interdites. Ce contenu ne peut pas être utilisé pour la formation en IA ou l'extraction de données sans le consentement de Tridge. Conditions de confidentialité Plan du site En cliquant sur Accepter les cookies, j'accepte de fournir des cookies à des fins statistiques et de préférences personnalisées. Pour en savoir plus sur nos cookies, veuillez lire notre Politique de confidentialité. Accepter les cookies",en,3891,617,16/10/2023,Allemagne,Bluetongue,"Ovins, Bovins",médias,"Le virus de la fièvre catarrhale ovine (Bluetongue) a été détecté en Allemagne après les Pays-Bas et la Belgique. Un mouton d'une ferme près de la frontière néerlandaise a été diagnostiqué positif, entraînant une quarantaine.","Le virus de la fièvre catarrhale ovine (Bluetongue) a été détecté en Allemagne après les Pays-Bas et la Belgique. Un mouton d'une ferme près de la frontière néerlandaise a été diagnostiqué positif, entraînant une quarantaine. Les tests ont montré que les autres animaux de la ferme n'ont pas de symptômes malgré cette détective. La maladie cause des dommages économiques importants dans la région car l'Allemagne perd son statut de zone sans maladie, ce qui entraîne des restrictions commerciales en matière d'animaux sensibles à la fièvre catarrhale ovine.","Le virus de la fièvre catarrhale ovine (Bluetongue) a été détecté en Allemagne après les Pays-Bas et la Belgique. Un mouton d'une ferme près de la frontière néerlandaise a été diagnostiqué positif, entraînant une quarantaine. Les tests ont montré que les autres animaux de la ferme n'ont pas de symptômes malgré cette détective. La maladie cause des dommages économiques importants dans la région car l'Allemagne perd son statut de zone sans maladie, ce qui entraîne des restrictions commerciales en matière d'animaux sensibles à la fièvre catarrhale ovine. Le virus serotype 3 est responsable de cette épidémie qui a commencé en août sur les fermes de moutons en Espagne et a été détectée par les autorités néerlandaises au début de septembre. Actuellement, près de 40 fermettes sont affectées dans la province d'Utrecht et le nord de l'Hollande, ainsi que des fermes de bovins. La maladie a déjà causé des pertes importantes en Espagne.",Fièvre catarrhale ovine (Bluetongue)
code152,https://lc.cx/sXWRhi,La fièvre catarrhale officiellement confirmée en Allemagne,"Logo TridgePlateforme commerciale mondiale Tridge Obtenez une démo Connectez-vous Actualités La fièvre catarrhale est officiellement confirmée en Allemagne Viande de bœuf avec os congelée Allemagne Autres politiques Offre +2 Publié le 17 octobre 2023 Résumé de Tridge Un animal individuel dans une ferme de Rhénanie du Nord-Westphalie, en Allemagne, a été affecté par la fièvre catarrhale du mouton, une maladie qui ne provoque aucun symptôme chez les autres animaux. En conséquence, l’ensemble de l’État perd son statut indemne de fièvre catarrhale et le commerce du bétail vulnérable n’est autorisé que sous certaines conditions. L’épidémie n’est pas une surprise, car il existe déjà une épidémie majeure aux Pays-Bas et d’autres infections sont attendues en Rhénanie du Nord-Westphalie et en Basse-Saxe. Avertissement : le résumé ci-dessus a été généré par le modèle d'IA exclusif de Tridge à des fins d'information. Contenu original Il s'agit pour l'instant d'un animal individuel de la ferme. Les autres animaux ne présentent aucun symptôme, rapporte le ministère de l'Agriculture de Rhénanie du Nord-Westphalie. L'entreprise concernée est bloquée et n'est pas autorisée à introduire ou à sortir des animaux. La fièvre catarrhale en Allemagne n'est pas une surprise En raison de l'épidémie, l'ensemble du Land perd son statut d'indemne de fièvre catarrhale. Le commerce des bovins sensibles à la fièvre catarrhale provenant de la région n'est autorisé que sous certaines conditions. L'Allemagne, la Belgique et les Pays-Bas en discutent. Le transport du bétail directement à l’abattoir est possible. Le laboratoire de référence allemand FLI n'est pas surpris de la contamination par la fièvre catarrhale en Allemagne, alors qu'il y a une épidémie majeure aux Pays-Bas. Les autorités s’attendent à de nombreuses autres infections, notamment en Rhénanie du Nord-Westphalie et en Basse-Saxe. Aux Pays-Bas, le nombre d'entreprises atteintes de la fièvre catarrhale est passé à 1 431 infections officielles. En outre, 732 entreprises ont déclaré... Source : Boerderij Vous souhaitez des informations plus approfondies ? Accédez à une analyse de marché détaillée adaptée aux besoins de votre entreprise. Contactez-nous pour en savoir plus Données de marché associées Curation Mars 2025 Marché d'exportation de la coupe de bœuf congelé avec os aux Pays-Bas 25 données sur les prix à l'exportation À lire ensuite Actualités Marchés mondiaux des céréales et des oléagineux Oilworld 5 décembre 2025 Actualités Les exportations mondiales d'huile de palme rebondissent après la faiblesse de 2024 UkrAgroConsult 4 décembre 2025 Actualités Le nombre de sangliers testés positifs à la peste porcine africaine en Catalogne s'élève à 13. Agrodiario 5 décembre 2025 Actualités L'UE assouplit les règles pour les plantes créées par modification génétique UkrAgroConsult 4 décembre 2025 Actualités L'UZAG prévoit la récolte de céréales et d'oléagineux en 2025 à un niveau de 81,4 millions de tonnes. Oilworld 5 décembre 2025 Lire le contenu plus pertinent Rapport Rapport de perspectives de septembre 2025 : Café, sucre, thé et cacao Victor Langat 26 septembre 2025 Rapport Rapport de perspectives de septembre 2025 : Viande Victor Langat 26 septembre 2025 Opinion Le marché américain des pommes fait face à une récolte record et à des vents contraires croissants Bojan Mijatovic 5 septembre 2025 Opinion Les mandarines Tango de l'Équateur font leurs débuts aux États-Unis après Négociation quinquennale Bojan Mijatovic 29 août 2025 Opinion Impact du typhon Kajiki sur l'agriculture vietnamienne : pertes localisées de riz, perturbation limitée du café Mzingaye Ndubiwa 28 août 2025 Opinion Impact des tarifs américains sur l'agriculture de l'UE : impacts sectoriels et réponses stratégiques Benjamin Lategan 22 août 2025 Opinion Les tarifs américains sur les fruits de mer brésiliens se répercutent à travers la chaîne d'approvisionnement Bojan Mijatovic Rapport du 22 août 2025 Rapport Outlook d'août 2025 : Huiles Xchel Perez 22 août 2025 Logo TridgePlateforme de trading mondiale Tridge Accueil de Tridge À propos de Tridge Centre d'aide Carrières Contactez-nous 2025 Tridge. Tous droits réservés. Toutes les données et analyses sont la propriété de Tridge. La reproduction, la distribution, la modification ou l'utilisation commerciale sans autorisation sont interdites. Ce contenu ne peut pas être utilisé pour la formation en IA ou l'extraction de données sans le consentement de Tridge. Conditions de confidentialité Plan du site En cliquant sur Accepter les cookies, j'accepte de fournir des cookies à des fins statistiques et de préférences personnalisées. Pour en savoir plus sur nos cookies, veuillez lire notre Politique de confidentialité. Accepter les cookies",en,3942,610,17 octobre 2023,Allemagne,Bluetongue,"Bovins, Ovins",médias,"Un animal bovin a été affecté par la fièvre catarrhale ovine (bluetongue) en Allemagne, entraînant la perte du statut de zone bluetongue-free.","La maladie a été détectée après les Pays-Bas et la Belgique. Un mouton d'une ferme près de la frontière néerlandaise a été diagnostiqué positif, entraînant une quarantaine pour l'ensemble du pays. Les autorités allemandes anticipent de nombreux plus d'infections, notamment en Rhénanie-du-Nord-Westphalie et en Basse-Saxe.","Le virus de la fièvre catarrhale ovine (bluetongue) a été détecté en Allemagne après les Pays-Bas et la Belgique. Un mouton d'une ferme près de la frontière néerlandaise a été diagnostiqué positif, entraînant une quarantaine pour l'ensemble du pays. Les autorités allemandes anticipent de nombreux plus d'infections, notamment en Rhénanie-du-Nord-Westphalie et en Basse-Saxe. La maladie a déjà eu un impact économique important sur les éleveurs et les exportateurs de viande bovine. Le gouvernement allemand a mis en place des mesures de quarantaine pour empêcher la propagation de la maladie et protéger l'industrie agricole.",Fièvre catarrhale ovine (Bluetongue)
code153,https://www.agriland.ie/farming-news/daera-urges-farmers-to-be-vigilant-for-bluetongue-and-ehd/,Daera exhorte les agriculteurs à être vigilants face à la fièvre catarrhale et à l'ehd,"Dernières nouvelles Boeuf Laitier Mouton Machines de travail du sol Irlande du Nord Vidéos Podcasts La DAERA exhorte les agriculteurs à être vigilants face à la fièvre catarrhale et à l'EHD Par Aisling O'Brien 18 octobre 2023 10h30 Partager cet article Le ministère de l'Agriculture, de l'Environnement et des Affaires rurales (DAERA) exhorte les agriculteurs à être vigilants face aux signes de fièvre catarrhale et de maladie hémorragique épizootique (EHD). Cet avertissement fait suite à la confirmation de l'EHD en France et à la récente propagation de la fièvre catarrhale (BTV) à travers l'Europe. L'EHD a été confirmée pour la première fois en Europe en octobre 2022 en Italie. Elle s'est depuis propagée au Portugal, en Espagne, avant d'atteindre la France. La maladie touche le plus gravement les cerfs, mais des cas cliniques ont été signalés chez des bovins dans plusieurs fermes de ces pays. Plusieurs souches de BTV circulent en Europe, avec près de 800 foyers confirmés. Les Pays-Bas ont signalé leur premier foyer de BTV depuis 2009 en septembre, suivis par les autorités belges en octobre. Le mois dernier, les autorités françaises ont confirmé la présence d'une nouvelle souche de la maladie, le BTV-8, qui provoque des signes cliniques plus graves chez les bovins et les ovins. DAERA DAERA conseille aux agriculteurs d'examiner attentivement les risques de maladie associés à l'approvisionnement en animaux provenant de régions d'Europe continentale où les virus ont été détectés. Le département a ajouté que les animaux importés infectés par le BTV seront abattus. En outre, aucune compensation ne sera versée et des restrictions de déplacement seront imposées sur l'exploitation pendant plusieurs mois, le temps d'une surveillance approfondie pour exclure toute propagation ultérieure. L'hébergement et l'isolement des animaux gravides importés seront également requis jusqu'à la naissance de la progéniture, qui devra être testée avec des résultats négatifs avant que les restrictions ne soient levées. Le vétérinaire en chef de l'Irlande du Nord (CVO), le Dr Robert Huey, a déclaré que la fièvre catarrhale et l'EHD étant des maladies vectorielles transmises par le vent et transmises par les moucherons, le principal risque pour l'Irlande du Nord est l'importation d'animaux infectés. Ce fut le cas en décembre 2018, lorsque la dernière détection du BTV a été découverte en Irlande du Nord, dans le cadre du programme de tests de routine post-importation du département », a déclaré le Dr Huey. « La maladie a été détectée chez une génisse importée de France dans une exploitation en Irlande du Nord. J'encourage fortement les agriculteurs à suivre les directives de la DAERA et à être conscients des risques importants et des conséquences potentiellement néfastes, tant pour eux-mêmes que pour l'industrie, de l'importation d'animaux en provenance ou du transit par des zones touchées. Une incursion de la fièvre catarrhale ou de la maladie hémorragique épizootique en Irlande du Nord entraînerait la perte du statut indemne de maladie, ce qui serait dévastateur pour l'industrie, a-t-il ajouté. Agriculteurs La DAERA a donné les conseils suivants aux agriculteurs : Toute personne qui importe des animaux en provenance d'une zone touchée par la fièvre catarrhale du mouton doit s'assurer que les animaux ont été vaccinés contre la maladie avant l'importation ; Si les animaux sont gravides, la vaccination doit avoir été effectuée de manière à ce que l'animal soit immunisé avant l'accouplement ; Il s'agit d'exigences légales et de conditions qui doivent être attestées par le vétérinaire officiel certificateur sur le certificat sanitaire ; Les agriculteurs devraient également envisager de demander des garanties supplémentaires au vendeur, comme un test préalable à l'exportation pour prouver l'immunité effective ; Si vous choisissez d'introduire des animaux en Irlande du Nord depuis une zone indemne de maladie via une zone infectée par la fièvre catarrhale du mouton, vous devez vous assurer de respecter toutes les conditions du certificat sanitaire d'exportation. Cela devrait inclure le traitement des animaux et des véhicules avec un insecticide approuvé et la garantie que toutes les parties du certificat sanitaire pour les animaux importés ont été respectées. La fièvre catarrhale touche tous les ruminants, comme les bovins, les chèvres, les cerfs et les moutons. Les symptômes peuvent inclure : Fièvre ; gonflement de la tête et du cou ; boiterie; inflammation des muqueuses de la bouche, du nez et des yeux ; baver; et le taux de mortalité est souvent élevé. L'EHD affecte le plus gravement les cerfs, mais des cas cliniques ont été signalés chez des bovins dans plusieurs fermes des pays européens touchés. Sujets Santé animale Fièvre des bovins Maladie DAERA EHD Moutons d'Irlande du Nord Partager cet article Plus d'histoires VIE RURALE il y a environ 2 ans Tánaiste lance un nouveau projet d'îles partagées pour les communautés rurales Tánaiste et le ministre des Affaires étrangères, Micheál Martin ont lancé un nouveau projet d'îles partagées... ENVIRONNEMENT il y a environ 2 ans ACRES : les progrès se poursuivent dans l'évaluation des communes L'évaluation des communes dans le cadre du programme agroclimatique pour l'environnement rural (ACRES) s'est poursuivie... SPONSORITÉ Qui sont les champions des CellCheck Milking for Quality Awards 2025 ? FBD Insurance et Animal Health Ireland (AHI) souhaitent féliciter les 16 champions CellCheck... une société Agriland Media Rejoignez la liste de diffusion Restez au courant de vos actualités lors de vos déplacements. Téléchargez l'application Agriland dès aujourd'hui. 2025 Agriland Media Ltd. Contactez-nous Conditions générales Politique de confidentialité Annoncez avec nous Marchandise",en,4934,770,18 octobre 2023,Irlande du Nord,Bluetongue,"Bovins, Ovins",médias,Le DAERA de l'Irlande du Nord a mis en garde les agriculteurs contre la fièvre catarrhale ovine (bluetongue) et la maladie hémorragique épizootique après des cas détectés en France.,"Le DAERA de l'Irlande du Nord a mis en garde les agriculteurs contre la fièvre catarrhale ovine (bluetongue) et la maladie hémorragique épizootique après des cas détectés en France. La maladie a été confirmée pour la première fois en Europe en 2022 en Italie, puis en Portugal, en Espagne et en France. Le DAERA conseille aux agriculteurs de prendre des précautions pour éviter l'importation d'animaux infectés.","Le DAERA de l'Irlande du Nord a mis en garde les agriculteurs contre la fièvre catarrhale ovine (bluetongue) et la maladie hémorragique épizootique après des cas détectés en France. La maladie a été confirmée pour la première fois en Europe en 2022 en Italie, puis en Portugal, en Espagne et en France. Le DAERA conseille aux agriculteurs de prendre des précautions pour éviter l'importation d'animaux infectés. Les animaux importés doivent être vaccinés contre la maladie avant leur arrivée, et les fermiers doivent également prendre des mesures de surveillance et de contrôle pour empêcher la propagation de la maladie dans le pays.",Fièvre catarrhale ovine (Bluetongue)
code155,https://lc.cx/V_Nr3n,économie,"Après la vague de punaises de lit, de nombreux pays européens, notamment la France, souffrent actuellement d'une autre maladie qui ravage les troupeaux. Ceci est lié à l'épidémie de maladie hémorragique des troupeaux, qui a signalé les premiers cas de cette maladie depuis septembre 2023, avant qu'elle ne se propage de manière alarmante au point que la France a dénombré 453 cas dans différents élevages du pays. Ce danger a mobilisé l’Office national de sécurité sanitaire des produits alimentaires (UNSA), qui suit l’évolution de la propagation du virus dans ces pays, d’autant plus que le Maroc continue d’importer des vaches, des veaux et des moutons pour combler l’écart entre l’offre et la demande sur les marchés du Royaume. Pour référence, cette maladie animale présente des signes cliniques similaires à ceux de la « fièvre catarrhale du mouton », notamment de la fièvre, une perte de poids, des plaies buccales et des difficultés respiratoires, mais avec un taux de mortalité très faible, et à ce jour il n’existe aucun vaccin contre cette maladie. Cependant, l'Office National de Sécurité Sanitaire des Produits Alimentaires continue de confirmer que tous les animaux vivants importés sont soumis à un contrôle strict et régulier au niveau des centres d'inspection frontaliers, en examinant leur état sanitaire, en vérifiant les certificats et documents sanitaires et en procédant aux examens nécessaires pour déterminer l'état sanitaire du troupeau au regard de certaines maladies animales infectieuses. Après cela, l'inspecteur vétérinaire de l'ONSA délivre un certificat sanitaire d'acceptation auquel est joint l'Office National de Sécurité Sanitaire des Produits Alimentaires, et seuls les animaux sains sont alors autorisés à entrer sur le territoire marocain.",ar,1169,191,19 octobre 2023,France,Bluetongue,"Ovins, Bovins",médias,"La France détecte des cas de Bluetongue chez les ovins et bovins, une maladie qui peut provoquer des symptoms tels que la fièvre, le poids perdu et les plaies faciales.",Le virus de la fièvre catarrhale ovine (Bluetongue) a été détecté en France après avoir été signalé dans d'autres pays européens. Le gouvernement français a mis en place des mesures de quarantaine pour prévenir la propagation de la maladie chez les ovins et bovins. Les animaux importés sont soumis à des contrôles stricts avant d'être autorisés à entrer dans le pays.,"La France a signalé une nouvelle épidémie de Bluetongue, une maladie qui peut provoquer des symptoms graves chez les ovins et bovins. Le virus a été détecté après avoir été signalé dans d'autres pays européens. Les autorités françaises ont mis en place des mesures de quarantaine pour prévenir la propagation de la maladie, notamment l'interdiction du commerce avec les animaux importés qui ne sont pas vaccinés ou qui n'ont pas été soumis à des contrôles stricts. Les éleveurs et les vétérinaires sont invités à signaler tout cas suspect de Bluetongue pour que les mesures de quarantaine puissent être mises en place rapidement.",Fièvre catarrhale ovine (Bluetongue)
