code,url,titre,contenu,langue,nb_caracteres,nb_mots,date_publication,lieu,maladie,animal,source_publication,resume_50_mots,resume_100_mots,resume_150_mots,maladie_normalisee
code165,https://fr.yna.co.kr/view/AFR20231023002500884,La Corée du Sud signale 4 nouveaux cas de dermatose nodulaire contagieuse,"Go to Contents Go to Navigation Notre site utilise des cookies et d'autres techniques pour offrir une meilleure qualité de service. En continuant à visiter le site, vous acceptez l'usage de ces techniques et notre politique. Voir en détail close Accepter Recherche Ajouter Français Facebook Twitter RSS Feed AGENCE DE PRESSE YONHAP Today's date 5 décembre 2025 Météo Séoul -2 IQA Moyen 76 Busan 2 IQA Bon 48 Últimas noticias Un jour dans l'histoire de la Corée A l instant Le ministère de l'Industrie et le britannique Arm formeront 1.400 spécialistes de la conception de semi-conducteurs A l instant reproducción/pausa Más Actualités National International Corée du Nord Economie Science/Tech Sport/Culture Hallyu Photos Vidéos La Corée du Sud signale 4 nouveaux cas de dermatose nodulaire contagieuse Lee Sae-rom Actualités 23.10.2023 à 16h51 SHARE LIKE SAVE PRINT FONT SIZE Le ministre de l'Agriculture, de l'Alimentation et des Affaires rurales Chung Hwang-keun prend la parole lors d'un audit à l'Assemblée nationale, le lundi 23 octobre 2023. SEOUL, 23 oct. (Yonhap) -- La Corée du Sud a rapporté de nouveaux cas de dermatose nodulaire contagieuse (DNC) sur fond d'inquiétudes sur une éventuelle propagation à l'échelle nationale de cette maladie hautement transmissible, a fait savoir ce lundi le ministère de l'Agriculture, de l'Alimentation et des Affaires rurales. «Il y a 14 cas d'infection et 638 têtes de bétail ont été abattues jusqu'à présent», a déclaré le ministre de l'Agriculture Chung Hwang-keun lors d'un audit à l'Assemblée nationale. Aujourd'hui, deux cas supplémentaires ont été signalés dans la province du Chungcheong du Sud alors que le Gyeonggi et le Chungcheong du Nord ont rapporté chacun un cas. Le pays a confirmé vendredi dernier ses tout premiers cas de DNC dans le Chungcheong du Sud. «Le nombre de cas confirmés continuera à augmenter», a prévenu Chung. La DNC est une maladie animale s'accompagnant de fièvre, de nodules sur la peau et d'anorexie. Transmise par des insectes hématophages, cette maladie contagieuse touche principalement les bovins et est rarement mortelle chez l'homme. Actuellement, tous les bétails des fermes infectées sont en train d'être abattus. «Si nous ne procédons pas à un abattage dans les fermes infectées, la maladie pourra se propager vers d'autres domaines dont le réseau du commerce de détail», a averti Chung en assurant que les exploitants affectés seront entièrement dédommagés. lsr@yna.co.kr (FIN) Mots clés #dnc A découvrir aussi Séoul désignera comme «minéraux critiques» les 17 terres rares pour plus de sécurité d'approvisionnement | AGENCE DE PRESSE YONHAP Un savon qui fonce les cheveux et aide à stimuler la pousse Revue Bien-Être Lee révoque le vice-ministre de l'Agriculture pour abus d'autorité | AGENCE DE PRESSE YONHAP Je perds moins de cheveux et ils sont plus foncés. Juste avec un savon. Revue Bien-Être Ils ne comprenaient pas le buzz autour de leurs photos jusqu à la révélation dans les commentaires lovemyfamilymag.com (URGENT) La Corée du Sud a enregistré une croissance de 1,3% au T3, plus forte que prévu initialement | AGENCE DE PRESSE YONHAP ""J'ai regardé hier"" : Pascal Praud fait son débrief du numéro de Complément d'enquête sur CNews et dit tout ce qu'il pense Purepeople Lee et la présidente du CIO mettent l'accent sur le rôle du sport dans les liens intercoréens | AGENCE DE PRESSE YONHAP par Taboola Contenus Sélectionnés Mots clés de l actualité #lee jae myung#ia#semi-conducteurs#20x10#aespa Le ministère de l'Industrie et le britannique Arm formeront 1.400 spécialistes de la conception de semi-conducteurs Lee met en avant sa vision pour l'IA lors d'une rencontre avec le PDG de SoftBank Le ministre du Commerce discute de la coopération avec les Pays-Bas dans les semi-conducteurs et la logistique Le dirigeant nord-coréen inspecte des usines régionales avant leur ouverture officielle Rumeurs de couple entre Jungkook de BTS et Winter d'aespa Les plus lus Rumeurs de couple entre Jungkook de BTS et Winter d'aespa La ville de Séoul émet l'alerte aux chutes de neige de niveau 1 Hyundai Motor signe un accord de coopération pour l'hydrogène avec Air Liquide Le dirigeant nord-coréen inspecte des usines régionales avant leur ouverture officielle Séoul désignera comme «minéraux critiques» les 17 terres rares pour plus de sécurité d'approvisionnement Les photos les plus vues Kim Jong-un Palais royal sous la neige Série Netflix «The Price of Confession» Sélectionneur national aux USA Vidéos 00:38 Gallup : la popularité de Lee en légère hausse à 62% Articles à la Une Lee met en avant sa vision pour l'IA lors d'une rencontre avec le PDG de SoftBank Hyundai Motor signe un accord de coopération pour l'hydrogène avec Air Liquide Rumeurs de couple entre Jungkook de BTS et Winter d'aespa Coupang : les fuites de données font baisser le nombre d'utilisateurs quotidiens Séoul désignera comme «minéraux critiques» les 17 terres rares pour plus de sécurité d'approvisionnement Pour ses 80 ans, Kia présente sa voiture concept Vision Meta Turismo Accueil Actualités Rubriques Actualités Economie Photos A la Une de la presse coréenne National Science/Tech Vidéos Un jour dans l histoire de la Corée International Sport/Culture Actualités à la Une Corée du Nord Hallyu Les plus lus Dossiers Interviews Gros plans Autres infos La Corée en bref Liens utiles Météo Outils RSS Site Internet mobile Présentation Qui sommes-nous ? Crédits Contact Copyright (c) Yonhap News Agency. All Rights Reserved. LANGUES Politique de confidentialité Facebook Twitter RSS Feed Plan du site",fr,5578,880,23 octobre 2023,Corée du Sud,Dermatose nodulaire contagieuse,"Bovins, Bétails",médias,La Corée du Sud a signalé de nouveaux cas de dermatose nodulaire contagieuse (DNC) après avoir confirmé les premiers cas vendredi dernier.,"Le ministre de l'Agriculture, Chung Hwang-keun, a annoncé que 14 cas d'infection et 638 têtes de bétail ont été abattues jusqu'à présent. Deux nouveaux cas supplémentaires ont été signalés dans la province du Chungcheong du Sud.","La Corée du Sud a confirmé les premiers cas de DNC vendredi dernier, et depuis, le nombre de cas confirmés continue à augmenter. Le gouvernement a pris des mesures pour abattre tous les bétails des fermes infectées pour empêcher la propagation de la maladie. Les exploitants affectés seront entièrement dédommagés. La DNC est une maladie animale s'accompagnant de fièvre, de nodules sur la peau et d'anorexie, transmise par des insectes hématophages.",Dermatose nodulaire contagieuse
code167,https://lc.cx/Li9ojh,MHE : 1 194 foyers de maladie hémorragique épizootique recensés en France au 20 octobre,"MHE : 1 194 foyers de maladie hémorragique épizootique recensés en France au 20 octobre À la date du 20 octobre 2023, 1 194 foyers de maladie hémorragique épizootique (MHE) ont été recensés en France. Ces foyers concernent huit départements : Pyrénées-Atlantiques, Hautes-Pyrénées, Haute-Garonne, Gers, Landes, Ariège, Aude, Tarn. SANTÉ ANIMALE",fr,344,51,20/10/2023,France,Maladie hémorragique épizootique,"Ovins, Bovins, Équidés, Volailles",médias,1 194 foyers de maladie hémorragique épizootique ont été recensés en France. La maladie hémorragique épizootique a été détectée dans huit départements.,"La maladie hémorragique épizootique a été détectée dans huit départements de France, notamment Pyrénées-Atlantiques, Hautes-Pyrénées, Haute-Garonne, Gers, Landes, Ariège, Aude et Tarn. Les foyers concernent principalement des ovins, des bovins, des équidés et des volailles.","La maladie hémorragique épizootique a été détectée dans huit départements de France, notamment Pyrénées-Atlantiques, Hautes-Pyrénées, Haute-Garonne, Gers, Landes, Ariège, Aude et Tarn. Les foyers concernent principalement des ovins, des bovins, des équidés et des volailles. La maladie a été détectée après une quarantaine de cas en Europe, notamment en Pays-Bas et en Belgique. Les autorités vétérinaires françaises ont mis en place des mesures de contrôle pour prévenir la propagation de la maladie.",Maladie hémorragique épizootique (MHE)
code169,https://lc.cx/5cqNjm,MHE : cette nouvelle maladie qui fait peur aux éleveurs des Pyrénées-Atlantiques,"MHE : cette nouvelle maladie qui fait peur aux éleveurs des Pyrénées-Atlantiques Il n existe pas pour l heure de vaccin afin de remédier à la maladie hémorragique épizootique dont de nombreux cas sont recensés en Béarn. ILLUSTRATION 0 PAR G. CAYRON, PUBLIÉ LE 22 OCTOBRE 2023 À 10H17. L arrivée de la maladie hémorragique épizootique, avec près de 2000 cas recensés dans le sud-ouest, inquiète le monde agricole même si cette contagion cause peu de décès dans le cheptel. Explications. Ce document ministériel montre bien que la nouvelle maladie impacte avant tout le sud-ouest, notamment les Pyrénées-Atlantiques et les Hautes Pyrénées. MINISTERE DE L AGRICULTURE Recevez nos newsletters Inscrivez-vous pour recevoir les newsletters de la Rép' dans votre boîte mail S'INSCRIRE Une nouvelle calamité pour les exploitants agricoles ? L affaire n est – heureusement – pas aussi limpide quand on évoque l arrivée sur le territoire de cette contagion frappant les élevages de bovins : il s agit de la MHE (pour maladie hémorragique épizootique). LA RÉDACTION VOUS CONSEILLE Maladie hémorragique épizootique : 12 foyers dans les Pyrénées-Atlantiques Au 5 octobre, le ministère de l Agriculture recensait 53 foyers de la maladie qui progresse parmi les élevages de bovins, dont 30 dans les Hautes-Pyrénées. Il y a quelques jours, le nombre de cas découverts semblait en pleine explosion (près de 2000 selon le ministère), impactant notamment les Pyrénées-Atlantiques et plus encore nos voisins bigourdans (ainsi... IL VOUS RESTE 90% DE CET ARTICLE À LIRE LISEZ LA SUITE DE L'ARTICLE EN VOUS ABONNANT À LA RÉPUBLIQUE DES PYRÉNÉES À partir de 1 par mois, sans engagement. M'ABONNER À PARTIR DE 1 Déjà abonné ? Identifiez-vous. LES SUJETS ASSOCIÉS Agriculture Social Montardon Pyrénées Éco Société Pyrénées-Atlantiques Articles abonnés AUCUN COMMENTAIRE Réagissez à cet article. Pour commenter, merci de vous connecter. CONNEXION",fr,1920,301,22/10/2023,Pyrénées-Atlantiques,Maladie hémorragique épizootique,Bovins,médias,"Une nouvelle maladie hémorragique épizootique a été détectée dans les Pyrénées-Atlantiques, entraînant des cas importants chez les éleveurs de bovins.","La maladie hémorragique épizootique a été détectée dans le sud-ouest de la France, notamment dans les Pyrénées-Atlantiques et les Hautes-Pyrénées. Les cas sont importants chez les éleveurs de bovins, mais la maladie cause peu de décès. Le ministère de l'Agriculture a déclaré que le nombre de cas découverts semblait en pleine explosion, avec près de 2000 cas recensés.","La maladie hémorragique épizootique est une nouvelle maladie qui fait peur aux éleveurs des Pyrénées-Atlantiques. Le nombre de cas découverts semblait en pleine explosion, avec près de 2000 cas recensés dans le sud-ouest de la France. Les Pyrénées-Atlantiques et les Hautes-Pyrénées sont les régions les plus touchées. Le ministère de l'Agriculture a déclaré que la maladie cause peu de décès, mais qu'elle a un impact important sur les éleveurs. Des mesures sont en cours pour contrôler la propagation de la maladie et protéger les éleveurs.",Maladie hémorragique épizootique (MHE)
code170,https://lc.cx/WL0piV,(LEAD) La Corée du Sud signale 7 nouveaux cas de dermatose nodulaire pour un total de 17 cas,"Go to Contents Go to Navigation Notre site utilise des cookies et d'autres techniques pour offrir une meilleure qualité de service. En continuant à visiter le site, vous acceptez l'usage de ces techniques et notre politique. Voir en détail close Accepter Recherche Ajouter Français Facebook Twitter RSS Feed AGENCE DE PRESSE YONHAP Today's date 5 décembre 2025 Météo Séoul -2 IQA Moyen 76 Busan 2 IQA Bon 48 Últimas noticias Un jour dans l'histoire de la Corée Le ministère de l'Industrie et le britannique Arm formeront 1.400 spécialistes de la conception de semi-conducteurs A l instant reproducción/pausa Más Actualités National International Corée du Nord Economie Science/Tech Sport/Culture Hallyu Photos Vidéos (LEAD) La Corée du Sud signale 7 nouveaux cas de dermatose nodulaire pour un total de 17 cas Actualités 23.10.2023 à 21h00 SHARE LIKE SAVE PRINT FONT SIZE SEOUL, 23 oct. (Yonhap) -- La Corée du Sud a signalé sept nouveaux cas de dermatose nodulaire contagieuse (DNC) chez des bovins, a déclaré lundi le ministère de l'Agriculture. Les autorités ont confirmé 17 cas d'infection depuis l'apparition du premier foyer vendredi dans la province du Chungcheong du Sud et 1.075 vaches ont été abattues jusqu'à présent, selon le ministère de l'Agriculture, de l'Alimentation et des Affaires rurales. Sur les sept cas signalés dans la journée, quatre l'ont été dans la province du Gyeonggi, deux dans la province du Chungcheong du Sud et le reste dans la province du Chungcheong du Nord. Quatre cas suspects sont actuellement examinés, a ajouté le ministère. La DNC est une maladie hautement infectieuse qui provoque des lésions cutanées, de la fièvre et une perte d'appétit, entraînant souvent une baisse de la production laitière, voire la mort. Elle affecte les bovins et les buffles par l'intermédiaire des moustiques et d'autres insectes hématophages. La maladie n'affecte cependant pas l'homme. Le gouvernement procède actuellement à l'abattage de tous les bovins dans les exploitations infectées. «Si nous ne procédons pas à l'abattage dans les exploitations infectées, la maladie risque de se propager à d'autres zones, y compris au réseau de vente au détail», a déclaré le ministre de l'Agriculture, Chung Hwang-keun, lors d'une séance d'audit à l'Assemblée nationale, précisant que les agriculteurs touchés seraient entièrement indemnisés. Une vache est vaccinée contre la dermatose nodulaire dans une ferme de Seosan, dans la province du Chungcheong du Sud, dans le centre de la Corée du Sud, le 23 octobre 2023. mathieu@yna.co.kr (FIN) Articles liés Déclaration des premiers cas de dermatose nodulaire contagieuse bovine en Corée Mots clés #dermatose nodulaire contagieuse A découvrir aussi Lee et la présidente du CIO mettent l'accent sur le rôle du sport dans les liens intercoréens | AGENCE DE PRESSE YONHAP Un savon qui fonce les cheveux et aide à stimuler la pousse Revue Bien-Être (URGENT) Lee : «Le 3 décembre sera désigné comme le Jour de la souveraineté du peuple» | AGENCE DE PRESSE YONHAP A 48 ans, Sonia Mabrouk attend son deuxième enfant ! Photo de sa fille Soraya, blondinette d'un an, pour l'annonce Purepeople Jean-Charles de Castelbajac : Avant Pauline, 40 ans de moins, il a été en couple avec une des plus belles femmes de France qui est mariée à un célèbre animateur Purepeople (URGENT) Lee réitère sa politique pour une «dénucléarisation qui met fin à l'état de guerre sur la péninsule coréenne» | AGENCE DE PRESSE YONHAP Ils ne comprenaient pas le buzz autour de leurs photos jusqu à la révélation dans les commentaires lovemyfamilymag.com Les transactions intragroupe des 10 plus grands conglomérats englobent environ 70% des transactions divulguées cette année | AGENCE DE PRESSE YONHAP par Taboola Contenus Sélectionnés Mots clés de l actualité #lee jae myung#ia#semi-conducteurs#20x10#aespa Le ministère de l'Industrie et le britannique Arm formeront 1.400 spécialistes de la conception de semi-conducteurs Lee met en avant sa vision pour l'IA lors d'une rencontre avec le PDG de SoftBank Le ministre du Commerce discute de la coopération avec les Pays-Bas dans les semi-conducteurs et la logistique Le dirigeant nord-coréen inspecte des usines régionales avant leur ouverture officielle Rumeurs de couple entre Jungkook de BTS et Winter d'aespa Les plus lus Rumeurs de couple entre Jungkook de BTS et Winter d'aespa La ville de Séoul émet l'alerte aux chutes de neige de niveau 1 Hyundai Motor signe un accord de coopération pour l'hydrogène avec Air Liquide Le dirigeant nord-coréen inspecte des usines régionales avant leur ouverture officielle Séoul désignera comme «minéraux critiques» les 17 terres rares pour plus de sécurité d'approvisionnement Les photos les plus vues Kim Jong-un Palais royal sous la neige Série Netflix «The Price of Confession» Sélectionneur national aux USA Vidéos 00:38 Gallup : la popularité de Lee en légère hausse à 62% Articles à la Une Lee met en avant sa vision pour l'IA lors d'une rencontre avec le PDG de SoftBank Hyundai Motor signe un accord de coopération pour l'hydrogène avec Air Liquide Rumeurs de couple entre Jungkook de BTS et Winter d'aespa Coupang : les fuites de données font baisser le nombre d'utilisateurs quotidiens Séoul désignera comme «minéraux critiques» les 17 terres rares pour plus de sécurité d'approvisionnement Pour ses 80 ans, Kia présente sa voiture concept Vision Meta Turismo Accueil Actualités Rubriques Actualités Economie Photos A la Une de la presse coréenne National Science/Tech Vidéos Un jour dans l histoire de la Corée International Sport/Culture Actualités à la Une Corée du Nord Hallyu Les plus lus Dossiers Interviews Gros plans Autres infos La Corée en bref Liens utiles Météo Outils RSS Site Internet mobile Présentation Qui sommes-nous ? Crédits Contact Copyright (c) Yonhap News Agency. All Rights Reserved. LANGUES Politique de confidentialité Facebook Twitter RSS Feed Plan du site",fr,5915,933,23 octobre 2023,Corée du Sud,Dermatose nodulaire contagieuse,"Bovins, Buffles",médias,"La Corée du Sud a signalé sept nouveaux cas de dermatose nodulaire contagieuse chez des bovins, portant le total à 17 cas. Les autorités ont confirmé l'abattage de 1 075 vaches.","Le gouvernement coréen a déclaré sept nouveaux cas de dermatose nodulaire contagieuse chez des bovins, portant le total à 17 cas. Les autorités ont confirmé l'abattage de 1 075 vaches dans les exploitations infectées pour empêcher la propagation de la maladie. La maladie affecte les bovins et les buffles par l'intermédiaire des moustiques et d'autres insectes hématophages.","La dermatose nodulaire contagieuse est une maladie hautement infectieuse qui provoque des lésions cutanées, de la fièvre et une perte d'appétit. Elle affecte les bovins et les buffles par l'intermédiaire des moustiques et d'autres insectes hématophages. Le gouvernement coréen a décidé d'abattre tous les bovins dans les exploitations infectées pour empêcher la propagation de la maladie, qui a déjà entraîné l'abattage de 1 075 vaches. Les agriculteurs touchés seront entièrement indemnisés. La Corée du Sud a signalé un total de 17 cas de dermatose nodulaire contagieuse depuis l'apparition du premier foyer vendredi dans la province du Chungcheong du Sud.",Dermatose nodulaire contagieuse
code171,https://wahis.woah.org/#/in-review/5294,WAHIS,WAHIS menu ACCUEIL keyboard_double_arrow_right keyboard_backspaceRetour au tableau de bord APERÇU DU RAPPORT Téléchargerdownload Ouvrir la cartepin_drop Algérie - Fièvre de West Nile - Rapport de suivi 1 [FINAL] INFORMATIONS GÉNÉRALES PAYS / TERRITOIRE OU ZONE ZONE TYPE D'ANIMAL TERRESTRE CATÉGORIE DE MALADIE Maladie de la liste IDENTIFIANT ÉVÉNEMENT 5294 MALADIE Fièvre de West Nile AGENT CAUSAL Virus de West Nile GÉNOTYPE / SÉROTYPE / SOUS-TYPE - DATE DE DÉBUT 2023/09/17 MOTIF DE NOTIFICATION Réapparition d une maladie éradiquée DATE DE DERNIÈRE APPARITION 2022/09/06 DATE DE CONFIRMATION 2023/09/24 STATUT DE L'ÉVÉNEMENT Résolu DATE DE FIN 2023/11/02 AUTO-DÉCLARATION NON INFORMATIONS DU RAPPORT NUMÉRO DU RAPPORT Rapport de suivi 1 IDENTIFIANT DU RAPPORT FUR_164345 RÉFÉRENCE DU RAPPORT - DATE DE SOUMISSION 2023/12/10 STATUT DU RAPPORT Validé RAPPORT SANS ÉVOLUTION - ÉPIDÉMIOLOGIE SOURCE DE L'ÉVÉNEMENT OU ORIGINE DE L'INFECTION Inconnue ou incertaine COMMENTAIRES ÉPIDÉMIOLOGIQUES Aucun commentaire épidémiologique RÉSUMÉ DES DONNÉES QUANTITATIVES UNITÉ DE MESURE Animal Espèce Sensibles Cas Morts Mis à mort et éliminés Abattus/Mis à mort à des fins commerciales Vaccinés Equidés (DOMESTIQUE) NOUVEAUX - - - - - - TOTAL 21 6 - - - - DÉTAILS DU DIAGNOSTIC SIGNES CLINIQUES NON MÉTHODE DE DIAGNOSTIC Epreuve de diagnostic Nom de l'épreuve Laboratoire Espèces échantillonnées Nombre de foyers échantillonnés Date du premier résultat Date du dernier résultat Résultat Méthode de dosage immuno-enzymatique de capture pour la détection de l'immunoglobuline M (IgM-capture ELISA) Laboratoire Central Vétérinaire Equidés 5 2023/09/24 2023/10/10 Positif MESURES DE LUTTE AU NIVEAU ÉVÉNEMENT MESURES DE LUTTE AU NIVEAU ÉVÉNEMENT ANIMAUX DOMESTIQUES ANIMAUX SAUVAGES Lutte contre les vecteurs Appliquée FOYERS MIS À JOUR OB_126671 - EL HADJAB OB_126672 - BARIKA OB_126673 - DOUCEN OB_126674 - SIDI AMRANE OB_126675 - DJAMAA WAHIS WAHIS Plateforme de formation Contact FAQ OMSA Site institutionnel Carrières RÉGIONS Afrique Amériques Asie et Pacifique Europe Moyen-Orient NOUS SUIVRE Termes et conditions d utilisation Politique de confidentialité Politique de cookies Copyright Organisation mondiale de la santé animale 2023,fr,2226,319,2023/09/17,Algérie,Fièvre de West Nile,Équidés,site officiel,"La fièvre de West Nile a été détectée en Algérie, entraînant la mort de plusieurs équidés.","La fièvre de West Nile est une maladie causée par le virus de West Nile. En Algérie, cette maladie a été détectée chez des équidés, entraînant des cas graves et la mort de plusieurs animaux. Les autorités vétérinaires ont mis en place des mesures de lutte pour contrôler la propagation de la maladie.","La fièvre de West Nile est une maladie grave causée par le virus de West Nile. En Algérie, cette maladie a été détectée chez des équidés, entraînant des cas graves et la mort de plusieurs animaux. Les autorités vétérinaires ont mis en place des mesures de lutte pour contrôler la propagation de la maladie, notamment la quarantaine des zones concernées et l'application de vaccins aux équidés. La situation est actuellement sous surveillance étroite pour éviter une réapparition de la maladie.",Fièvre du Nil occidental (West Nile)
