code,url,titre,contenu,langue,nb_caracteres,nb_mots,date_publication,lieu,maladie,animal,source_publication,resume_50_mots,resume_100_mots,resume_150_mots
code151,https://lc.cx/nKVbsM,Bluetongue virus was detected in Europe,"Tridge LogoGlobal trading platform Tridge Get a demo Sign In News Bluetongue virus was detected in Europe Lamb Meat Belgium Other Policies Germany +6 Published Oct 16, 2023 Tridge summary The bluetongue virus has been detected in Germany after previously being found in the Netherlands and Belgium. The virus was diagnosed in a sheep on a farm near the Dutch border, leading to quarantine measures. The virus, which mainly affects cattle, sheep, and goats, is spread by midges and causes severe symptoms in sheep. Disclaimer:The above summary was generated by Tridge's proprietary AI model for informational purposes. Original content After the Netherlands and Belgium, the bluetongue virus was also detected in Germany. The competent authorities diagnosed the disease in a sheep on a farm near the Dutch border. According to the tests, the other animals on the farm show no signs of illness, regardless of this, quarantine was ordered. The disease causes serious economic damage in the region, as North Rhine-Westphalia loses its disease-free status - and this means trade restrictions in relation to animal species susceptible to bluetongue. The first cases of the current wave were detected in August on sheep farms in Spain, and then discovered by the Dutch authorities at the beginning of September. Typically, the presence of the virus was detected on sheep farms, and today nearly 40 livestock farms are affected in North Holland and the province of Utrecht. However, animals have already tested positive for the virus on some cattle farms. The virus serotype 3 is responsible for the disease in the region, which produces ... Source: Agraragazat Would you like more in-depth insights? Gain access to detailed market analysis tailored to your business needs. Contact us to learn more Related market data Curation March, 2025 Export market for Frozen Bone-in Beef Cut in Netherlands 25 export price data Curation March, 2024 Export market for Frozen Bone-in Beef Cut in Spain 20 export price data What to read next News Seafood exports could reach the 11 billion USD mark AgroInfo.vn · Dec 1, 2025 News Pig prices today 1/12/2025: The upward trend continues Agriculture · Dec 1, 2025 News Vietnam's surimi exports surge by 24%, with the EU and China becoming new growth engines. Foodmate · Dec 1, 2025 News Norwegian cod prices have been adjusted, Russian quotes continue to rise, and Chinese buyers' purchasing intentions are low. Foodmate · Dec 1, 2025 News Trade Express | Overview of Major Alcoholic Beverage Exports in September 2025 Foodmate · Nov 30, 2025 Read more relevant content Report September 2025 Outlook Report: Coffee, Sugar, Tea, and Cocoa Victor Langat · Sep 26, 2025 Report September 2025 Outlook Report: Meat Victor Langat · Sep 26, 2025 Opinion US Apple Market Faces Record Harvest and Mounting Headwinds Bojan Mijatovic · Sep 5, 2025 Opinion Ecuador's Tango Mandarins Make Their US Debut After Five-Year Negotiation Bojan Mijatovic · Aug 29, 2025 Opinion Typhoon Kajiki’s Impact on Vietnamese Agriculture: Localized Rice Losses, Limited Coffee Disruption Mzingaye Ndubiwa · Aug 28, 2025 Opinion Impact of US Tariffs on EU Agriculture: Sectoral Impacts and Strategic Responses Benjamin Lategan · Aug 22, 2025 Opinion US Tariffs on Brazilian Seafood Ripple Through the Supply Chain Bojan Mijatovic · Aug 22, 2025 Report August 2025 Outlook Report: Oils Xchel Perez · Aug 22, 2025 Tridge LogoGlobal trading platform Tridge Tridge Home About Tridge Help Center Careers Contact us © 2025 Tridge. All Rights Reserved. All data and analyses are the property of Tridge. Reproduction, distribution, modification, or commercial use without permission is prohibited. This content may not be used for AI training or data extraction without Tridge’s consent. Privacy Terms Sitemap By clicking “Accept Cookies,” I agree to provide cookies for statistical and personalized preference purposes. To learn more about our cookies, please read our Privacy Policy. Accept Cookies",en,3987,634,16-10-2023,Europe,Virus de la tongue bleue,Moutons,médias,Le virus de la tongue bleue a été détecté en Allemagne après avoir été trouvé aux Pays-Bas et en Belgique. Une quarantaine a été mise en place sur une ferme proche de la frontière néerlandaise.,"Le virus de la tongue bleue a été détecté en Allemagne après avoir été trouvé aux Pays-Bas et en Belgique. Une quarantaine a été mise en place sur une ferme proche de la frontière néerlandaise. Le virus, qui principalement affecte les bovins, les moutons et les chèvres, est transmis par des moustiques et provoque des symptômes graves chez les moutons.","Le virus de la tongue bleue a été détecté en Allemagne après avoir été trouvé aux Pays-Bas et en Belgique. Une quarantaine a été mise en place sur une ferme proche de la frontière néerlandaise. Le virus, qui principalement affecte les bovins, les moutons et les chèvres, est transmis par des moustiques et provoque des symptômes graves chez les moutons. La maladie cause des dommages économiques importants dans la région, car le Nord Rhénanie-Westphalie perd son statut de zone sans maladie - ce qui signifie des restrictions commerciales en rapport avec les espèces animales sensibles au virus de la tongue bleue."
code152,https://lc.cx/sXWRhi,Bluetongue officially confirmed in Germany,"Tridge LogoGlobal trading platform Tridge Get a demo Sign In News Bluetongue officially confirmed in Germany Frozen Bone-In Beef Meat Germany Other Policies Supply +2 Published Oct 17, 2023 Tridge summary An individual animal on a farm in North Rhine-Westphalia, Germany has been affected by bluetongue, a disease that causes no symptoms in other animals. As a result, the entire state loses its bluetongue-free status and trade in vulnerable cattle is only allowed under certain conditions. The outbreak was not a surprise, as there is already a major outbreak in the Netherlands, and more infections are expected in North Rhine-Westphalia and Lower Saxony. Disclaimer:The above summary was generated by Tridge's proprietary AI model for informational purposes. Original content For the time being, it concerns an individual animal on the farm. The other animals show no symptoms, the North Rhine-Westphalia Ministry of Agriculture reports. The affected company is blocked and is not allowed to bring in or take out animals. Bluetongue in Germany no surprise Due to the outbreak, the entire state loses its bluetongue-free status. Trade in cattle that are sensitive to bluetongue from the area is only allowed under certain conditions. Germany, Belgium and the Netherlands are discussing this. Transport of livestock directly to slaughter is possible. The German reference laboratory FLI is not surprised about the contamination of bluetongue in Germany, now that there is a major outbreak in the Netherlands. The authorities are anticipating many more infections, especially in North Rhine-Westphalia and Lower Saxony. In the Netherlands, the number of companies with bluetongue has increased to 1,431 official infections. In addition, there are 732 companies that reported ... Source: Boerderij Would you like more in-depth insights? Gain access to detailed market analysis tailored to your business needs. Contact us to learn more Related market data Curation March, 2025 Export market for Frozen Bone-in Beef Cut in Netherlands 25 export price data What to read next News Seafood exports could reach the 11 billion USD mark AgroInfo.vn · Dec 1, 2025 News Pig prices today 1/12/2025: The upward trend continues Agriculture · Dec 1, 2025 News Vietnam's surimi exports surge by 24%, with the EU and China becoming new growth engines. Foodmate · Dec 1, 2025 News Norwegian cod prices have been adjusted, Russian quotes continue to rise, and Chinese buyers' purchasing intentions are low. Foodmate · Dec 1, 2025 News Trade Express | Overview of Major Alcoholic Beverage Exports in September 2025 Foodmate · Nov 30, 2025 Read more relevant content Report September 2025 Outlook Report: Coffee, Sugar, Tea, and Cocoa Victor Langat · Sep 26, 2025 Report September 2025 Outlook Report: Meat Victor Langat · Sep 26, 2025 Opinion US Apple Market Faces Record Harvest and Mounting Headwinds Bojan Mijatovic · Sep 5, 2025 Opinion Ecuador's Tango Mandarins Make Their US Debut After Five-Year Negotiation Bojan Mijatovic · Aug 29, 2025 Opinion Typhoon Kajiki’s Impact on Vietnamese Agriculture: Localized Rice Losses, Limited Coffee Disruption Mzingaye Ndubiwa · Aug 28, 2025 Opinion Impact of US Tariffs on EU Agriculture: Sectoral Impacts and Strategic Responses Benjamin Lategan · Aug 22, 2025 Opinion US Tariffs on Brazilian Seafood Ripple Through the Supply Chain Bojan Mijatovic · Aug 22, 2025 Report August 2025 Outlook Report: Oils Xchel Perez · Aug 22, 2025 Tridge LogoGlobal trading platform Tridge Tridge Home About Tridge Help Center Careers Contact us © 2025 Tridge. All Rights Reserved. All data and analyses are the property of Tridge. Reproduction, distribution, modification, or commercial use without permission is prohibited. This content may not be used for AI training or data extraction without Tridge’s consent. Privacy Terms Sitemap By clicking “Accept Cookies,” I agree to provide cookies for statistical and personalized preference purposes. To learn more about our cookies, please read our Privacy Policy. Accept Cookies",en,4038,627,17-10-2023,Allemagne,Bluetongue,Bœuf,médias,"Une maladie de bœuf en Allemagne, la bluetongue, a été confirmée. L'ensemble du land perd son statut de zone bluetongue-free.","La bluetongue a été confirmée dans une ferme d'Allemagne, ce qui signifie que l'ensemble du land perd son statut de zone bluetongue-free. Les animaux affectés ne montrent pas de symptômes, mais les conditions de trade sont restreintes.","La bluetongue a été confirmée dans une ferme d'Allemagne, ce qui signifie que l'ensemble du land perd son statut de zone bluetongue-free. Les animaux affectés ne montrent pas de symptômes, mais les conditions de trade sont restreintes. La situation n'est pas surprenante, car il y a déjà une épidémie importante en Pays-Bas et on attend plus d'infections dans la région."
code153,https://lc.cx/JSB3wp,DAERA urges farmers to be vigilant for bluetongue and EHD,"Latest News Beef Dairy Sheep Tillage Machinery Northern Ireland Videos Podcasts Black Friday Sale - 10% Off Everything! DAERA urges farmers to be vigilant for bluetongue and EHD By Aisling O'Brien October 18, 2023 10:30 AM Share this article The Department of Agriculture, Environment and Rural Affairs (DAERA) is urging farmers to be vigilant for signs of bluetongue and Epizootic Haemorrhagic Disease (EHD). The warning follows the confirmation of EHD in France, and the recent spread of bluetongue (BTV) across Europe. EHD was confirmed for the first time in Europe in October 2022 in Italy. It has since spread to Portugal, Spain, before reaching France. The disease affects deer most severely, but clinical cases have been reported in cattle at multiple farms in these countries. Several strains of BTV have been circulating in Europe, with nearly 800 outbreaks confirmed. The Netherlands reported their first outbreak of BTV since 2009 in September, followed by the Belgium authorities in October. Last month, French authorities confirmed the presence of a new strain of the disease, BTV-8, which is causing more severe clinical signs in cattle and sheep. DAERA DAERA is advising farmers to carefully consider the disease risks associated with sourcing animals from areas in mainland Europe where the viruses have been detected. The department added that imported animals found to be infected with BTV will be slaughtered. In addition, no compensation will be paid, and movement restrictions will be placed on the holding for several months while extensive surveillance is carried out to rule out further spread. Housing and isolation of imported pregnant animals will also be required until the birth of the progeny, which must be tested with negative results before restrictions will be lifted. Northern Ireland’s chief veterinary officer (CVO), Dr. Robert Huey said as both bluetongue and EHD are windborne vector diseases transmitted through midges, the main risk for Northern Ireland is the importation of infected animals. “This was the case in December 2018, when the last detection of BTV was discovered in Northern Ireland, as part of the department’s routine post-import testing regime,"" Dr. Huey said. ""The disease was detected in a heifer imported from France to a holding in Northern Ireland. “I would strongly encourage farmers to follow the DAERA guidance and to be aware of the significant risks and the potentially adverse consequences, both for themselves and for the industry, of importing animals from, or transiting through affected areas. “An incursion of bluetongue or Epizootic Haemorrhagic Disease to Northern Ireland would result in the loss of disease-free status which would be devastating for the industry, he added. Farmers DAERA has offered the following advice to farmers: Anyone who imports animals from a bluetongue affected area must ensure that the animals have been vaccinated against the disease prior to import; If the animals are pregnant, the vaccination must have been carried out so that the animal was immune before mating; These are legal requirements and conditions must be attested to by the certifying official veterinarian on the health certificate; Farmers should also consider seeking additional guarantees from the seller such as a pre-export test to prove effective immunity; If you choose to bring animals into Northern Ireland from a disease-free zone via a bluetongue infected zone you must ensure you comply with all the conditions on the export health certificate. This should include the treatment of animals and vehicles with an approved insecticide and ensuring all parts of the health certificate for the imported animals have been met. Bluetongue affects all ruminants, such as cattle, goats, deer and sheep. Symptoms may include: Fever; swelling of the head and neck; lameness; inflammation of the mucous membranes of the mouth, nose and eyes; drooling; and there is often a high mortality rate. EHD affects deer most severely, but clinical cases have been reported in cattle at multiple farms in affected European countries. Topics Animal Health Bluetongue Cattle DAERA Disease EHD Northern Ireland Sheep Share this article More Stories RURAL LIFE about 2 years ago Tánaiste launches new Shared Island Project for rural communities Tánaiste and Minister for Foreign Affairs, Micheál Martin launched a new Shared Island Project... ENVIRONMENT about 2 years ago ACRES: Progress continues on assessment of commonages The assessment of commonages under the Agri-Climate Rural Environment Scheme (ACRES) has continued... SPONSORED Tackling lameness the practical way: Two farmers share their stories Treating lameness is one of those jobs every farmer knows needs doing - but not every yard is set... an Agriland Media company Join Mailing List Stay on top of your news on the go. Download the Agriland app today. © 2025 Agriland Media Ltd. Contact Us Terms & Conditions Privacy Policy Advertise with us Merchandise",en,4981,780,18-10-2023,"Europe, France, Portugal, Espagne, Pays-Bas, Belgique, Irlande du Nord",Bluetongue et Epizootic Haemorrhagic Disease (EHD),"Cattle, Sheep, Cerf, Vache, Mouton",médias,Le DAERA alerte les agriculteurs à être vigilants pour les signes de bluetongue et d'EHD en raison de la confirmation de l'EHD en France et de la récente propagation de la bluetongue en Europe.,"La confirmation de l'EHD en France suit la récente propagation de la bluetongue (BTV) en Europe. L'EHD a été confirmé pour la première fois en Europe en octobre 2022 en Italie et a depuis atteint Portugal, Espagne et France. La maladie affecte principalement les cerfs, mais des cas cliniques ont été signalés chez les vaches à plusieurs fermes dans ces pays.","Les Pays-Bas ont signalé leur premier éclat de BTV depuis 2009 en septembre, tandis que les autorités belges l'ont confirmé en octobre. En France, les autorités ont confirmé la présence d'une nouvelle variante du virus, BTV-8, qui provoque des signes cliniques plus graves chez les vaches et moutons. Le DAERA conseille aux agriculteurs de prendre des précautions pour éviter l'importation d'animaux infectés et de suivre les directives du département pour minimiser les risques de propagation de la maladie."
code154,https://lc.cx/fnYicq,Erreur,Erreur lors du scraping,fr,23,4,inconnue,inconnu,inconnue,inconnu,médias,Erreur lors du scraping est une erreur générale qui peut survenir lors de l'extraction des données d'un site web. Il s'agit souvent d'une limitation technique ou d'un problème de configuration.,"Erreur lors du scraping est un terme utilisé pour décrire les erreurs qui peuvent se produire lors de l'extraction des données d'un site web. Ces erreurs peuvent être dues à divers facteurs tels que la limite raisonnable, une erreur technique ou une configuration incorrecte.","Erreur lors du scraping est un terme utilisé pour décrire les erreurs qui peuvent se produire lors de l'extraction des données d'un site web. Ces erreurs peuvent être dues à divers facteurs tels que la limite raisonnable, une erreur technique ou une configuration incorrecte. Il s'agit souvent d'une limitation technique ou d'un problème de configuration qui peut empêcher l'accès aux données souhaitées."
code155,https://lc.cx/V_Nr3n,اقتصاد,"بعد موجة بق الفراش، ترزح العديد من الدول الأوربية حاليا، لاسيما فرنسا تحت مرض آخر يعصف بالقطعان. يتعلق الأمر بمرض النزف الوبائي بين القطعان الذي أعلن عن أولى حالات هذا المرض منذ شهر شتنبر 2023، قبل أن يتفشى بشكل مقلق لدرجة أن فرنسا، أحصت 453 حالة بمختلف مزارع البلاد. هذا الخطر استنفر المكتب الوطني للسلامة الصحية للنتجات الغذائية ""أونسا"" الذي يراقب تطورات انتشار الفيروس بهذه الدول، خصوصا أن المغرب مازال يستورد الأبقار والعجول والأغنام لسد الفجوة بين الطلب والعرض في أسواق المملكة. للإشارة، فإن هذا المرض الحيواني له علامات سريرية مشابهة لأعراض «مرض اللسان الأزرق»، بما في ذلك الحمى وفقدان الوزن وجروح الفم وصعوبات التنفس، لكن مع معدل وفيات منخفض جدا، وحتى اليوم لا يوجد لقاح ضد هذا المرض. لكن المكتب الوطني للسلامة الصحية للمنتجات الغذائية مافتئ يؤكد أن جميع الحيوانات الحية المستوردة تخضع لرقابة صارمة ومنتظمة على مستوى مراكز التفتيش على الحدود، من خلال فحص حالتها الصحية و التحقق من الشهادات والوثائق الصحية وإجراء الفحوصات اللازمة لتحديد الحالة الصحية للقطيع فيما يتعلق ببعض الأمراض الحيوانية المعدية. بعد ذلك،يصدر المفتش البيطري في أونسا شهادة صحية للقبول يضيف المكتب الوطني للسلامة الصحية للمنتجات الغذائية، ثم يسمح فقط للحيوانات السليمة بدخول الأراضي المغربية.",ar,1169,191,inconnue,"Europe, France, Maroc",nezf oubati,abqar et ajol,médias,"Merde nzbifi entre les abqar et ajol en France, avec 453 cas confirmes. Le mرض a des symptomes similaires à ceux de la maladie du lisan bleu.","Le mرض nzbifi est une maladie qui affecte les abqar et ajol en Europe, notamment en France. Il a été confirmé pour la première fois en septembre 2023 et a déjà touché 453 cas. Les symptomes sont similaires à ceux de la maladie du lisan bleu, avec des feux, perte de poids, blessures buccales et difficultés respiratoires. Le taux de mortalité est très bas. Le mرض est transmis par les abqar et ajol importés, qui sont soumis à une inspection stricte avant d'être autorisés à entrer dans le pays.","Le mرض nzbifi est une maladie qui affecte les abqar et ajol en Europe, notamment en France. Il a été confirmé pour la première fois en septembre 2023 et a déjà touché 453 cas. Les symptomes sont similaires à ceux de la maladie du lisan bleu, avec des feux, perte de poids, blessures buccales et difficultés respiratoires. Le taux de mortalité est très bas. Le mرض est transmis par les abqar et ajol importés, qui sont soumis à une inspection stricte avant d'être autorisés à entrer dans le pays. Les autorités marocaines prennent des mesures pour prévenir la propagation du mرض, notamment en inspectant les animaux importés et en mettant en place des mesures de sécurité."
code156,https://lc.cx/ayCp8T,www.elfagr.org,www.elfagr.org Nous vérifions que vous êtes humain. Cette opération peut prendre quelques secondes. www.elfagr.org doit vérifier la sécurité de votre connexion avant de continuer. Ray ID: 9a70c5b6adcc5bd0 Performance et sécurité par Cloudflare,fr,243,32,inconnue,inconnu,inconnue,inconnu,médias,Aucune information sur une maladie animale est disponible.,Le texte fourni ne contient pas d'informations sur une maladie animale. Il semble être un site web de vérification d'identité humaine.,Il n'y a aucune information sur une maladie animale ou un animal concerné dans le texte fourni.
