code,url,titre,contenu,langue,nb_caracteres,nb_mots,date_publication,lieu,maladie,animal,source_publication,resume_50_mots,resume_100_mots,resume_150_mots
code161,https://lc.cx/zfrVjC,MHE : un cas en Suisse,"Sanitaire MHE : un cas en Suisse Le Groupement de défense sanitaire (GDS) de la Loire annonçait, en fin de semaine dernière, un cas de Maladie hémorragique épizootique (MHE) en Suisse. La zone réglementée n’atteint pas la Loire. Le ministère de l’Agriculture signalait, de son côté, que les animaux issus des zones réglementées peuvent désormais être exportés vers l’Italie, sous condition. Publié le 19 Octobre 2023 Partager l'article Facebook LinkedIn X-Twitter Les exportations vers l’Italie de broutards issus de zone réglementée MHE vont pouvoir reprendre, annonçait, en fin de semaine dernière, le ministère de l’Agriculture. Vendredi 13 octobre, le GDS (Groupement de défense sanitaire) de la Loire informait sur la situation vis-à-vis de la FCO (Fièvre catarrhale ovine), donnant suite « aux récentes suspicions cliniques de FCO/MHE effectuées par des vétérinaires pour des éleveurs de la Loire. Sept d’entre elles ont été confirmées en FCO 8. La majorité concerne des troupeaux bovins et un troupeau ovin. » Ces résultats confirment que « la FCO 8 circule dans la Loire à ce jour ». Le communiqué du GDS précise que « cela n’implique pas de modifications des conditions d’échange. En revanche, l’impact clinique reste relativement important, notamment pour des animaux adultes. La désinsectisation et la gestion des vecteurs plus globalement sont un outil de prévention qui est toujours important ». Quant à la MHE (Maladie hémorragique épizootique), la détection de tout nouveau foyer entraîne des mesures de lutte et de prévention spécifiques dans un rayon de 150 km autour des foyers. Le 13 octobre, le département de la Loire n’était pas concerné, ni par des cas, ni par une zone réglementée. Zone réglementée au Sud et à l’Est À la date du 12 octobre, 453 foyers de MHE avaient été recensés en France dans des élevages. Ces foyers concernent les départements suivants : Pyrénées-Atlantiques, Hautes-Pyrénées, Haute-Garonne, Gers, Landes, Ariège. Le GDS précise que « le nombre de foyers a augmenté de manière importante dans le Sud-Ouest, passant de 50 à 140 foyers déclarés au cours de la semaine écoulée ». Néanmoins, la zone réglementée dans cette région « n’évolue que très peu géographiquement ». Les recommandations du GDS restent les mêmes que pour la FCO : gestion des vecteurs, et notamment la désinsectisation pour limiter la transmission du virus par les culicoïdes (moucherons piqueurs) entre les animaux. Le ministère de l’Agriculture indique que « dans les élevages infectés, le nombre d’animaux atteint est inférieur à 3 %. La mortalité constatée reste par ailleurs très faible (inférieure à 0,1 %). Une étude est engagée dans des élevages infectés pour consolider ces données. Les soins mis en œuvre permettent, dans la quasi-totalité des cas, une guérison des animaux malades en quelques jours. » L’évolution concernant la MHE est localisée à l’Est de la France. Effectivement, la Suisse a enregistré, durant la semaine du 9 octobre, son premier foyer, à proximité de Berne. « Cela implique une nouvelle zone réglementée sur certaines communes des départements notamment de l’Ain, des Savoie, du Jura, du Doubs, de Saône-et-Loire ou d’Alsace, etc. » Dans son communiqué, le GDS rappelle les règles de mouvement des animaux en lien avec la MHE : - les mouvements nationaux entre zone réglementée et zone indemne se font sous couvert d'une désinsectisation et d'une PCR dans les sept jours avant mouvement ; - pour les bovins provenant des zones indemnes (cas de la Loire), rien ne s'oppose au maintien des mouvements dans l’Union européenne des bovins selon des modalités inchangées. Exportations Le ministère de l’Agriculture annonçait, dans un communiqué daté du 12 octobre, que « les autorités sanitaires italiennes viennent de donner leur accord à une réouverture des importations de jeunes bovins destinés à l’engraissement (broutards) à partir de l’ensemble du territoire français ». Premier débouché des broutards français (870 000 animaux en 2022), l’Italie avait fermé ses frontières aux bovins issus de la zone réglementée de 150 km autour des foyers de MHE. L’accord avec Rome « sera formalisé dans les prochains jours », précise la Rue de Varenne. Il prévoit notamment que les animaux « devront être désinsectisés et testés avant leur départ ». Cité dans le communiqué, le ministre de l’Agriculture a salué « un énorme soulagement pour nos filières d’élevage ». « Le sérieux des mesures de gestion et de surveillance mises en œuvre, ainsi que l’excellence du dispositif de suivi sanitaire français ont largement contribué à ce résultat favorable », s’est-il félicité. Le 3 octobre, Marc Fesneau avait annoncé la réouverture de l’Espagne, deuxième débouché avec 86 000 têtes. Quant à l’Algérie, la troisième destination (69 000 animaux en 2022), elle est encore fermée. « Reconnaissons que c’est plus complexe », avait admis M. Fesneau le 3 octobre, évoquant une réouverture « sans doute dans un temps un peu plus long ». De son côté, le GDS de la Loire annonçait, le 13 octobre, que « les exportations vers la Tunisie ont repris pour les bovins provenant uniquement de départements situés en dehors de la zone réglementée ». Dans un communiqué du 12 octobre, la FNB (Fédération nationale bovine, FNSEA) demandait une « prise en charge par l’État » des surcoûts dus au maintien des animaux en ferme. L’Italie refusait jusque-là les bovins vifs issus de la zone réglementée d’un rayon de 150 km autour des foyers de MHE (maladie hémorragique épizootique). Les éleveurs d’une quinzaine de départements du Sud de la France étaient donc « contraints de maintenir les animaux sur les exploitations », avec à la clé des « surcoûts » et des « frais sanitaires ». Par ailleurs, « la valeur des animaux ne doit en aucun cas être affectée », souligne la FNB, ajoutant que « le marché demeure très favorable avec une offre réduite du fait de la décapitalisation ». À plus long terme, « l’enjeu est à la déclassification de la maladie au plan européen », rappelle son président Patrick Bénézit, cité dans le communiqué. La réouverture de l’Italie « participe à lever la tension qui s’exerçait progressivement sur les éleveurs de la zone réglementée », se félicite l’association spécialisée de la FNSEA. LGF, d’après communiqués et AgraPresse",fr,6270,1017,19-10-2023,"Suisse, France",Maladie hémorragique épizootique (MHE),Bovins,médias,Un cas de MHE a été signalé en Suisse. Les exportations de broutards issus de zones réglementées peuvent reprendre vers l'Italie.,"Le GDS de la Loire a annoncé un cas de FCO/MHE, confirmé par des vétérinaires pour des éleveurs de la Loire. Les exportations de broutards issus de zones réglementées peuvent reprendre vers l'Italie.","La Suisse a enregistré son premier foyer de MHE, à proximité de Berne. La zone réglementée s'étend aux départements de l'Ain, des Savoie, du Jura, du Doubs, de Saône-et-Loire ou d'Alsace. Les recommandations pour la gestion des vecteurs et la désinsectisation restent les mêmes que pour la FCO."
code162,https://lc.cx/fhGf6b,"Jura
« Covid de la vache » en Suisse : quelles conséquences pour le Jura ?","Jura « Covid de la vache » en Suisse : quelles conséquences pour le Jura ? La maladie hémorragique épizootique (MHE) a été détectée sur des bovins, la semaine du 9 octobre, à proximité de Berne, en Suisse. Une zone réglementée de 150 km a été établie autour du foyer, englobant plus de 450 communes jurassiennes. Pour éviter la propagation, des contraintes sont appliquées pour les éventuels déplacements d’animaux hors de la zone. Arnaud Bastion - 19 oct. 2023 à 06:00 | mis à jour le 19 oct. 2023 à 09:59 - Temps de lecture : 3 min Lire dans l'application | Les montbéliardes du Jura ne sont, pour l’heure, pas atteintes par la maladie mais sont concernées par la zone réglementée. Illustration Philippe Trias La maladie est apparue dans le sud de l’Europe en octobre 2022. Depuis quelques semaines, l’expression « Covid de la vache » (« Covid de las vacas » en espagnol) est utilisée de l’autre côté des Pyrénées pour parler de la maladie hémorragique épizootique (MHE). Mais à part provoquer de la fièvre, des difficultés respiratoires ou le nez qui coule, les comparaisons avec le Covid-19 s’arrêtent là. La MHE ne se transmet pas directement entre animaux infectés. Ce sont des moucherons, des Culicoïdes, eux-mêmes contaminés, qui véhiculent le virus. La maladie affecte les ruminants sauvages et domestiques et, dans une moindre mesure, les ovins et caprins. Les services de l ’État précisent que la MHE « n’est pas transmissible à l’homme » et que « la consommation de la viande est sans danger ». « Les symptômes sont très proches de la fièvre catarrhale ovine (FCO). La seule solution pour confirmer la MHE est l’analyse de sang. Pour l’heure, il n’y a pas de vaccin mais les vétérinaires peuvent intervenir pour soigner les symptômes et soulager les animaux », détaille Franck Morel, directeur du GDS (Groupement départemental de défense sanitaire) du Jura, entité qui assure des missions déléguées par l’État, notamment l’accompagnement des éleveurs dans leurs actions sanitaires. Avec le foyer identifié récemment en Suisse, le préfet du Jura a pris, conformément aux dispositions prévues au niveau national d’établir une zone réglementée de 150 km autour du foyer, un arrêté en date du 16 octobre pour lister les 458 communes concernées, soit plus de 90 % du département. Des contraintes chronophages Le déplacement des animaux en dehors du périmètre est conditionné au respect de plusieurs mesures telles que la désinsectisation des bêtes au moins 14 jours avant le voyage et le dépistage sanguin (pour analyse PCR) à partir du 15e jour. Le résultat, qui doit être négatif, est valable au maximum 7 jours. « Ce sont des contraintes très chronophages pour l’éleveur. Sans parler du coût des tests PCR », précise Franck Morel. Selon lui, les principales difficultés vont concerner le transport des veaux, notamment les mâles, vendus bien souvent en dehors de la Franche-Comté. « Si le froid s’installe, la circulation vectorielle par les moucherons devrait diminuer. Mais même si, en France, nous avons très peu de recul sur cette maladie, elle ne devrait pas décimer des cheptels », avance le directeur du GDS. À part dans des élevages de bovins du sud-ouest en septembre 2023, aucun autre cas n’est recensé en France. Les sorties des zones réglementées restent donc, pour le moment, limitées. À noter que le ministère de l’agriculture indique que « dans les élevages infectés, le nombre d’animaux atteint est inférieur à 3 %. La mortalité constatée reste par ailleurs très faible (inférieure à 0,1 %) ». « Un peu d’inquiétude pour la vente des veaux » Dans un département où les élevages bovins sont essentiellement à production laitière, les veaux sont voués, pour la plupart, à quitter le Jura. C’est ce point qui semble surtout préoccuper les agriculteurs. « Il y a un peu d’inquiétude pour la vente des veaux. Les mâles sont vendus, élevés et engraissés pour la filière viande en dehors du Jura et même, bien souvent, en Espagne. En général, ils partent lorsqu’ils sont âgés entre 15 jours et 1 mois. Il y a pas mal de vêlages en ce moment et tous les agriculteurs n’auront pas la capacité de les garder en attendant que la situation se décante », relate Philippe Cornu, président des Jeunes agriculteurs du Jura, qui précise que les ventes françaises pourraient être priorisées. L’autre crainte se situe au niveau de l’exportation de génisses. « Souvent, elles partent lorsqu’elles sont proches du terme. Cela pourrait donc aussi compliquer la tâche des éleveurs. » A.B Agriculture Économie ► Signaler une erreur dans cet article 0 commentaire RÉAGIR Articles les plus lus Économie 1 Rhône.Elle a perdu 48 000 euros en cinq mois : cette commerçante appelle à l’aide 2 Nord-Isère.A Diémoz et Crémieu, des commerçants en détresse ferment boutique 3 Lyon.« Le Black Friday, ça pue » : le mouvement « Bloquons-tout » orchestre une ... Newsletter. L'actualité économique du jour Du lundi au vendredi Retrouvez les temps forts de l'actualité économique, dans nos régions, en France et dans le monde. Saisissez votre e-mail Peut contenir des publicités. Protection des données",fr,5090,847,19-10-2023,"Suisse, Jura",Maladie hémorragique épizootique (MHE),Vaches et mâles de vache,médias,Une zone réglementée a été établie autour du foyer en Suisse pour éviter la propagation de la maladie hémorragique épizootique (MHE). Les contraintes sont appliquées pour les déplacements d'animaux hors de la zone.,"La maladie hémorragique épizootique (MHE) a été détectée en Suisse, notamment dans le Jura. Une zone réglementée de 150 km a été établie autour du foyer pour éviter la propagation. Les contraintes sont appliquées pour les déplacements d'animaux hors de la zone, notamment des tests PCR et des désinsectisations.","La maladie hémorragique épizootique (MHE) a été détectée en Suisse, notamment dans le Jura. Une zone réglementée de 150 km a été établie autour du foyer pour éviter la propagation. Les contraintes sont appliquées pour les déplacements d'animaux hors de la zone, notamment des tests PCR et des désinsectisations. Les agriculteurs sont préoccupés par la vente des veaux, qui sont souvent vendus en Espagne ou dans d'autres régions. Le ministère de l'agriculture indique que la mortalité est très faible et que les consommations de viande sont sans danger."
code163,https://lc.cx/EXSgFD,WAHIS,"WAHIS menu ACCUEIL keyboard_double_arrow_right keyboard_backspaceRetour au tableau de bord APERÇU DU RAPPORT Téléchargerdownload Ouvrir la cartepin_drop Corée (Rép. de) - Dermatose nodulaire contagieuse (Inf. par le virus de la) - Rapport de suivi 9 [FINAL] Préférences en matière de gestion des cookies L’OMSA utilise des cookies pour mesurer le trafic sur son site web et analyser ses performances. Vous pouvez accepter l'utilisation de cookies en cliquant sur ""J'accepte"" ou refuser ces cookies en cliquant sur ""Je refuse"". Cependant, si vous refusez certains cookies, cela pourrait affecter votre expérience de navigation. Consultez notre Politique de confidentialité pour en savoir plus. En savoir plus (https://www.woah.org/fr/politique-de-confidentialite/) Préférences pour tous les services J'accepte Mesure de l'audience Google Analytics En savoir plus (https://www.woah.org/fr/politique-de-confidentialite/) J'accepte Je refuse",fr,937,121,inconnue,Corée (Rép. de),inconnue,inconnu,médias,Aucune information sur une maladie animale spécifique.,Aucune information sur une maladie animale spécifique. Le texte ne contient aucune mention de maladie ou d'animal.,"Aucune information sur une maladie animale spécifique. Le texte est un aperçu du rapport de suivi de l'OMSA, mais il ne contient pas d'informations sur une maladie animale."
code164,https://lc.cx/4RWWSk,Tuberculose : surveillance renforcée pour les bovins importés d’Irlande du Nord,"Tuberculose : surveillance renforcée pour les bovins importés d’Irlande du Nord À la suite d’un foyer français de tuberculose en lien avec l’introduction d’un bovin provenant d’Irlande du Nord, le ministère de l’Agriculture met en place un protocole de surveillance renforcée appliqué aux bovins importés de ce pays. JE M'ABONNE Publié le 23/10/2023, Mis à jour le 27/10/2023 Partager Lire plus tard En cas d'introduction de bovins vivants en France depuis l’Irlande du Nord, un arrêté préfectoral de mise sous surveillance (APMS) sera rédigé afin de « mettre en œuvre des mesures d’isolement et de contrôle à destination, le temps de vérifier si le bovin est atteint de tuberculose ». © Cédric Faimali/GFA Le ministère de l’Agriculture serre la vis à l’égard des bovins en provenance de l’Irlande du Nord. Dans une instruction technique publiée le 12 octobre 2023, il détaille les modalités de surveillance renforcée appliquées aux bovins introduits d’Irlande du Nord. Et pour cause : le 13 juillet 2023, « un foyer de tuberculose a été déclaré dans un élevage situé sur la commune d’Hémevez (Manche) à la suite de la confirmation de l’infection sur un bovin né en Irlande du Nord, puis introduit en France en 2017 », rapporte l’instruction. La tuberculose bovine, un fléau pour la filière britannique (02/06/2023) Isolement et dépistage Pour mettre en place cette surveillance renforcée, une vérification des mouvements d’introduction de bovins vivants en France depuis l’Irlande du Nord sera réalisée via le logiciel TRACES NT par les directions départementales de l’emploi, du travail, des solidarités et de la protection des populations. (DD (ETS) PP). Le cas échéant, un arrêté préfectoral de mise sous surveillance (APMS) sera rédigé afin de « mettre en œuvre des mesures d’isolement et de contrôle à destination, le temps de vérifier si le bovin est atteint de tuberculose ». Les frais de ces mesures sont « à la charge du propriétaire, du destinataire, de l’expéditeur ou, à défaut, de tout opérateur intervenant dans l’introduction de bovins originaires d’Irlande du Nord sur le territoire métropolitain ». Tuberculose bovine : l’indemnisation pour les abattages diagnostics revalorisés (12/04/2023) Par Vincent Guyot",fr,2227,351,23-10-2023,"France, Irlande du Nord",tuberculose bovine,bovin,médias,Le ministère de l'Agriculture met en place un protocole de surveillance renforcée pour les bovins importés d'Irlande du Nord en raison d'un foyer de tuberculose déclaré dans un élevage français.,Un protocole de surveillance renforcée a été mis en place pour les bovins importés d'Irlande du Nord en raison d'un foyer de tuberculose déclaré dans un élevage français. Les bovins vivants introduits depuis l'Irlande du Nord sont soumis à une vérification des mouvements d'introduction via le logiciel TRACES NT.,"Le ministère de l'Agriculture a mis en place un protocole de surveillance renforcée pour les bovins importés d'Irlande du Nord en raison d'un foyer de tuberculose déclaré dans un élevage français. Les bovins vivants introduits depuis l'Irlande du Nord sont soumis à une vérification des mouvements d'introduction via le logiciel TRACES NT. Les frais de ces mesures sont à la charge du propriétaire, du destinataire, de l'expéditeur ou, à défaut, de tout opérateur intervenant dans l'introduction de bovins originaires d'Irlande du Nord sur le territoire métropolitain."
code165,https://lc.cx/shm7ON,La Corée du Sud signale 4 nouveaux cas de dermatose nodulaire contagieuse,"Go to Contents Go to Navigation Notre site utilise des cookies et d'autres techniques pour offrir une meilleure qualité de service. En continuant à visiter le site, vous acceptez l'usage de ces techniques et notre politique. Voir en détail close Accepter Recherche Ajouter Français Facebook Twitter RSS Feed AGENCE DE PRESSE YONHAP Today's date 1 décembre 2025 Météo Séoul 9 ℃IQA Moyen 62 Busan 17 ℃IQA Mauvais 218 Últimas noticias Kia dévoile les premières images de son tout nouveau Seltos KOSPI-clôture A l’instant reproducción/pausa Más Actualités National International Corée du Nord Economie Science/Tech Sport/Culture Hallyu Photos Vidéos La Corée du Sud signale 4 nouveaux cas de dermatose nodulaire contagieuse Lee Sae-rom Actualités 23.10.2023 à 16h51 SHARE LIKE SAVE PRINT FONT SIZE Le ministre de l'Agriculture, de l'Alimentation et des Affaires rurales Chung Hwang-keun prend la parole lors d'un audit à l'Assemblée nationale, le lundi 23 octobre 2023. SEOUL, 23 oct. (Yonhap) -- La Corée du Sud a rapporté de nouveaux cas de dermatose nodulaire contagieuse (DNC) sur fond d'inquiétudes sur une éventuelle propagation à l'échelle nationale de cette maladie hautement transmissible, a fait savoir ce lundi le ministère de l'Agriculture, de l'Alimentation et des Affaires rurales. «Il y a 14 cas d'infection et 638 têtes de bétail ont été abattues jusqu'à présent», a déclaré le ministre de l'Agriculture Chung Hwang-keun lors d'un audit à l'Assemblée nationale. Aujourd'hui, deux cas supplémentaires ont été signalés dans la province du Chungcheong du Sud alors que le Gyeonggi et le Chungcheong du Nord ont rapporté chacun un cas. Le pays a confirmé vendredi dernier ses tout premiers cas de DNC dans le Chungcheong du Sud. «Le nombre de cas confirmés continuera à augmenter», a prévenu Chung. La DNC est une maladie animale s'accompagnant de fièvre, de nodules sur la peau et d'anorexie. Transmise par des insectes hématophages, cette maladie contagieuse touche principalement les bovins et est rarement mortelle chez l'homme. Actuellement, tous les bétails des fermes infectées sont en train d'être abattus. «Si nous ne procédons pas à un abattage dans les fermes infectées, la maladie pourra se propager vers d'autres domaines dont le réseau du commerce de détail», a averti Chung en assurant que les exploitants affectés seront entièrement dédommagés. lsr@yna.co.kr (FIN) Mots clés #dnc A découvrir aussi De nombreux acteurs renden t un ultime hommage à Lee Soon-jae | AGENCE DE PRESSE YONHAP Si vous voyez cette punaise brune dans votre jardin, vous devez prendre des... lovemyfamilymag.com Séoul-Washington : proposit ion d'un organe consultatif pour le suivi de l'accord tarifa ire | AGENCE DE PRESSE... Attention : la présence de cette punaise brune exige une action urgente lovemyfamilymag.com Richard Gere a choisi de quitter les Etats-Unis pour sa femme plus jeune que... Purepeople BTS : les titres solo de Jung kook totalisent plus de 10 Mds de streams sur Spotify | AGENCE DE PRESSE... Ces célébrités sont à peine reconnaissables sans maqui llage womentales.com (LEAD) Loi martiale : la motion d'arrestation de l'ex -chef du groupe parlement aire du PPP adoptée | AGE... par Taboola Contenus Sélectionnés Mots clés de l’actualité #accord de swap de devises#achats en ligne#billboard 200#cinéma#corée du sud-canada Les autorités engagent des discussions pour renouveler l'accord de swap de changes du NPS Record d'achats en ligne en octobre grâce au bond des ventes de Tesla «Do It» de Stray Kids est le 8e album du groupe à dominer le Billboard 200 Cinéma : «Zootopie 2» en tête du box-office pour sa 1ère semaine en Corée Séoul demande à Ottawa d'abandonner ses nouvelles mesures de protection de son industrie sidérurgique Les plus lus (LEAD) Coupang : les données personnelles des trois quarts adultes de Corée ont fuité Plus de 8 mlns de ménages d'une seule personne en Corée du Sud en 2024 (LEAD) Lee donnera une allocution pour le 1er anniversaire de la loi martiale Le groupe Lazarus aurait commis 31 cyberattaques au cours des 12 derniers mois Coupang : les données personnelles des trois quarts des adultes de Corée ont fuité Les photos les plus vues Père et fille Kim Jong-un Vol acrobatique nord-coréen Arrivée Vidéos 00:49 Les autorités engagent des discussions pour renouveler l'accord de swap de changes du NPS Articles à la Une «Do It» de Stray Kids est le 8e album du groupe à dominer le Billboard 200 Les travailleurs de Seoul Metro lancent une «grève du zèle» ce lundi matin Nongshim lance 3 gobelets de nouilles instantanées inspirés par «KPop Demon Hunters» Cinéma : «Zootopie 2» en tête du box-office pour sa 1ère semaine en Corée Kia dévoile les premières images de son tout nouveau Seltos Coupang : comment les données de 33,7 mlns d'utilisateurs ont pu fuiter ? Accueil Actualités Rubriques Actualités Economie Photos A la Une de la presse coréenne National Science/Tech Vidéos Un jour dans l’histoire de la Corée International Sport/Culture Actualités à la Une Corée du Nord Hallyu Les plus lus Dossiers Interviews Gros plans Autres infos La Corée en bref Liens utiles Météo Outils RSS Site Internet mobile Présentation Qui sommes-nous ? Crédits Contact Copyright (c) Yonhap News Agency. All Rights Reserved. LANGUES Politique de confidentialité Facebook Twitter RSS Feed Plan du site",fr,5336,853,01-12-2025,Corée du Sud,Dermatose nodulaire contagieuse (DNC),Bétails (bovins),médias,"La Corée du Sud a signalé de nouveaux cas de dermatose nodulaire contagieuse, une maladie animale hautement transmissible.","Le ministre de l'Agriculture a annoncé 14 cas d'infection et 638 têtes de bétail abattues. Deux nouveaux cas supplémentaires ont été signalés dans la province du Chungcheong du Sud, tandis que le Gyeonggi et le Chungcheong du Nord ont rapporté chacun un cas.","La Corée du Sud a confirmé ses tout premiers cas de DNC dans le Chungcheong du Sud. Le nombre de cas confirmés continue à augmenter, selon le ministre de l'Agriculture. La maladie est transmise par des insectes hématophages et touche principalement les bovins. Les exploitants affectés seront entièrement dédommagés si un abattage dans les fermes infectées n'est pas effectué."
