code,url,titre,contenu,langue,nb_caracteres,nb_mots,date_publication,lieu,maladie,source_type,resume_50,resume_100,resume_150,entites_nommees
code163,https://wahis.woah.org/#/in-review/5290,WAHIS,"WAHIS ACCUEIL keyboard_double_arrow_right keyboard_backspace Retour au tableau de bord Corée (Rép. de) - Dermatose nodulaire contagieuse (Inf. par le virus de la) - Rapport de suivi 9 [FINAL] INFORMATIONS GÉNÉRALES PAYS / TERRITOIRE OU ZONE PAYS/TERRITOIRE TYPE D'ANIMAL TERRESTRE CATÉGORIE DE MALADIE Maladie de la liste IDENTIFIANT ÉVÉNEMENT 5290 MALADIE Dermatose nodulaire contagieuse (Inf. par le virus de la) AGENT CAUSAL Virus de la dermatose nodulaire contagieuse GÉNOTYPE / SÉROTYPE / SOUS-TYPE - DATE DE DÉBUT 2023/10/19 MOTIF DE NOTIFICATION Première apparition dans le pays DATE DE DERNIÈRE APPARITION - DATE DE CONFIRMATION 2023/10/20 STATUT DE L'ÉVÉNEMENT Résolu DATE DE FIN 2023/12/21 AUTO-DÉCLARATION NON INFORMATIONS DU RAPPORT NUMÉRO DU RAPPORT Rapport de suivi 9 IDENTIFIANT DU RAPPORT FUR_165515 RÉFÉRENCE DU RAPPORT - DATE DE SOUMISSION 2024/02/05 STATUT DU RAPPORT Validé RAPPORT SANS ÉVOLUTION - ÉPIDÉMIOLOGIE SOURCE DE L'ÉVÉNEMENT OU ORIGINE DE L'INFECTION Inconnue ou incertaine COMMENTAIRES ÉPIDÉMIOLOGIQUES Aucun commentaire épidémiologique RÉSUMÉ DES DONNÉES QUANTITATIVES UNITÉ DE MESURE Animal Espèce Sensibles Cas Morts Mis à mort et éliminés Abattus/Mis à mort à des fins commerciales Vaccinés Bovins (DOMESTIQUE) NOUVEAUX - - - 4 - - TOTAL 6761 313 - 6672 - - DÉTAILS DU DIAGNOSTIC SIGNES CLINIQUES OUI MÉTHODE DE DIAGNOSTIC Epreuve de diagnostic Nom de l'épreuve Laboratoire Espèces échantillonnées ID du foyer Date du résultat Résultat Réaction en chaîne de la polymérase de transcription inverse (RT-PCR) Animal and Plant Quarantine Agency (APQA), Ministry of Agriculture, Food and Rural Affairs (MAFRA) Bovins ob_126637 2023/10/20 Positif MESURES DE LUTTE AU NIVEAU ÉVÉNEMENT MESURES DE LUTTE AU NIVEAU ÉVÉNEMENT ANIMAUX DOMESTIQUES ANIMAUX SAUVAGES Désinfestation Appliquée Désinfection Appliquée Restriction des déplacements Appliquée Quarantaine Appliquée Surveillance des vecteurs Appliquée Abattage sanitaire Appliquée Surveillance à l’intérieur de la zone de restriction Appliquée Lutte contre les vecteurs Appliquée Destruction officielle des carcasses, des sous-produits et des déchets Appliquée Dépistage Appliquée FOYERS MIS À JOUR ob_127915 - Geonbongsa-ro, Ganseong-eup, Goseong-gun, Gangwon-do, Republic of Korea ob_127916 - Baekgol-gil, Homyeong-myeon, Yecheon-gun, Gyeongsangbuk-do, Republic of Korea ob_126637 - 113-21, Jisan 2-gil, Buseok-myeon, Seosan-si, Chungcheongnam-do. Republic of Korea FOYERS PRÉCÉDEMMENT NOTIFIÉS ob_126886 - 79-29, Tongpowon-gil, Sinpyeong-myeon, Dangjin-si, Chungcheongnam-do, Republic of Korea ob_126887 - 47, Eoyeon-gil, Cheongbuk-eup, Pyeongtaek-si, Gyeonggi-do, Republic of Korea ob_126888 - 244, Injeong-ro, Buseok-myeon, Seosan-si, Chungcheongnam-do, Republic of Korea ob_126889 - 81-79, Yeonhwabong-ro, Haseong-myeon, Gimpo-si, Gyeonggi-do, Republic of Korea ob_126890 - 377-49, Poseungjangan-ro, Poseung-eup, Pyeongtaek-si, Gyeonggi-do, Republic of Korea ob_126891 - 451, Nae-ri, Iwon-myeon, Taean-gun, Chungcheongnam-do, Republic of Korea ob_126892 - 620-11, Jisan-ri, Buseok-myeon, Seosan-si, Chungcheongnam-do, Republic of Korea ob_126893 - 528-23, Jisan-ri, Buseok-myeon, Seosan-si, Chungcheongnam-do, Republic of Korea ob_126894 - 384, Bongnakjisan-gil, Buseok-myeon, Seosan-si, Chungcheongnam-do, Republic of Korea ob_126895 - 370, Gageum-ri, Haseong-myeon, Gimpo-si, Gyeonggi-do, Republic of Korea ob_126896 - 244, Injeong-ro, Buseok-myeon, Seosan-si, Chungcheongnam-do, Republic of Korea ob_126897 - 104-18, Sinnam-gil, Sinpyeong-myeon, Dangjin-si, Chungcheongnam-do, Republic of Korea ob_126898 - 35-1, Baengmaryeong-gil 287beon-gil, Wonnam-myeon, Eumseong-gun, Chungcheongbuk-do, Republic of Korea ob_126899 - 291-169, Jeongmunhoehwa-ro, Seotan-myeon, Pyeongtaek-si, Gyeonggi-do, Republic of Korea ob_126900 - 49, Gurwonan-gil, Ujeong-eup, Hwaseong-si, Gyeonggi-do, Republic of Korea ob_126901 - 226-21, Songsanpodo-ro, Songsan-myeon, Hwaseong-si, Gyeonggi-do, Republic of Korea ob_126902 - 67-6, Sieoji-gil, Buseok-myeon, Seosan-si, Chungcheongnam-do, Republic of Korea ob_126903 - 330-10, Mandongpo-ro, Sinpyeong-myeon, Dangjin-si, Chungcheongnam-do, Republic of Korea ob_126904 - 854, Namsan-ri, Sinpyeong-myeon, Dangjin-si, Chungcheongnam-do, Republic of Korea ob_126905 - 854, Namsan-ri, Sinpyeong-myeon, Dangjin-si, Chungcheongnam-do, Republic of Korea ob_126906 - 494-7, Bolli-ro, Sunseong-myeon, Dangjin-si, Chungcheongnam-do, Republic of Korea ob_126907 - 28, Gwanggyosan-ro 509beon-gil, Jangan-gu, Suwon-si, Gyeonggi-do, Republic of Korea ob_126908 - 7-36, Angol-gil, Hwado-myeon, Ganghwa-gun, Incheon, Republic of Korea ob_126909 - 204-2, Gyosan-ri, Yangsa-myeon, Ganghwa-gun, Incheon, Republic of Korea ob_126910 - 1003-8, Ganghwaseo-ro, Hajeom-myeon, Ganghwa-gun, Incheon, Republic of Korea ob_126911 - 319-31, Yangnam-ro, Guktojeongjungang-myeon, Yanggu-gun, Gangwon-do, Republic of Korea ob_126912 - 374-6, Bongnakjisan-gil, Buseok-myeon, Seosan-si, Chungcheongnam-do, Republic of Korea ob_126913 - 178-1, Geocha-ri, Seobu-myeon, Hongseong-gun, Chungcheongnam-do, Republic of Korea ob_126914 - 61-13, Bonggok 1-gil, Ujeong-eup, Hwaseong-si, Gyeonggi-do, Republic of Korea ob_126915 - 303-64, Jeonmangdae-ro, Songhae-myeon, Ganghwa-gun, Incheon, Republic of Korea ob_126916 - 926-5, Gangdang-ri, Buseok-myeon, Seosan-si, Chungcheongnam-do, Republic of Korea ob_126917 - 1-81, Mandongpo-ro, Sinpyeong-myeon, Dangjin-si, Chungcheongnam-do, Republic of Korea ob_126918 - 201-57, Sinjuk-ro, Baeksan-myeon, Buan-gun, Jeollabuk-do, Republic of Korea ob_126919 - 522-46, Yagam-ro, Daegot-myeon, Gimpo-si, Gyeonggi-do, Republic of Korea ob_126920 - 50-3, Bambachirwon-gil, Ujeong-eup, Hwaseong-si, Gyeonggi-do, Republic of Korea ob_126921 - 535, Pyeongbat-gil, Ujeong-eup, Hwaseong-si, Gyeonggi-do, Republic of Korea ob_126922 - 108-72, Yamak-gil, Jinwi-myeon, Pyeongtaek-si, Gyeonggi-do, Republic of Korea ob_126923 - 84, Gageum-ro 227beon-gil, Haseong-myeon, Gimpo-si, Gyeonggi-do, Republic of Kore ob_126924 - 950, Samgeo-ri, Gunnam-myeon, Yeoncheon-gun, Gyeonggi-do, Republic of Korea ob_126925 - 144-21, Eundae-ro, Jeongok-eup, Yeoncheon-gun, Gyeonggi-do, Republic of Korea ob_126926 - 25, Gyeonggang-ro jeonggeum 2-gil, Ucheon-myeon, Hoengseong-gun, Gangwon-do, Republic of Korea ob_126927 - 43, Garoji-gil, Ujeong-eup, Hwaseong-si, Gyeonggi-do, Republic of Korea ob_126928 - 76, Aejeong-gil, Inji-myeon, Seosan-si, Chungcheongnam-do, Republic of Korea ob_126929 - 23-24, Seosa-gil 41beon-gil, Yangsa-myeon, Ganghwa-gun, Incheon, Republic of Korea ob_126930 - 762-5, Samgeo-ri, Hajeom-myeon, Ganghwa-gun, Incheon, Republic of Korea ob_126931 - 44-31, Jangjeongyango-gil, Hajeom-myeon, Ganghwa-gun, Incheon, Republic of Korea ob_126932 - 470, Wollongsan-ro, Tanhyeon-myeon, Paju-si, Gyeonggi-do, Republic of Korea ob_126933 - 68-22, Malgupduri-gil, Jeokseong-myeon, Paju-si, Gyeonggi-do, Republic of Korea ob_126934 - 105, Sutangwon-ro, Seongdong-myeon, Nonsan-si, Chungcheongnam-do, Republic of Korea ob_126935 - 74-10, Yeomseong-ri, Yeomchi-eup, Asan-si, Chungcheongnam-do, Republic of Korea ob_126936 - 101, Hanseong-gil, Soheul-eup, Pocheon-si, Gyeonggi-do, Republic of Korea ob_127038 - 270-3, Naehyang-ro, Jeongnam-myeon, Hwaseong-si, Gyeonggi-do, Republic of Korea ob_127039 - 485-1, Jisan-ri, Buseok-myeon, Seosan-si, Chungcheongnam-do, Republic of Korea ob_127040 - 226, Oyujeosu-gil, Haean-myeon, Yanggu-gun, Gangwon-do, Republic of Korea ob_127041 - 19, Dangnam 2-gil, Daesin-myeon, Yeoju-si, Gyeonggi-do, Republic of Korea ob_127042 - 251-1, Jeongwang-dong, Siheung-si, Gyeonggi-do, Republic of Korea ob_127043 - 81-45, Beotkkot-ro 694beon-gil, Dogo-myeon, Asan-si, Chungcheongnam-do, Republic of Korea ob_127044 - 65-7, Sampo-gil, Jugwang-myeon, Goseong-gun, Gangwon-do, Republic of Korea ob_127045 - 456-3, Samgeo-ri, Gunnam-myeon, Yeoncheon-gun, Gyeonggi-do, Republic of Korea ob_127046 - 142-57, Dongmokjang-gil, Mangun-myeon, Muan-gun, Jeollanam-do, Republic of Korea ob_127047 - 546, Samhwa-ri, Seongmun-myeon, Dangjin-si, Chungcheongnam-do, Republic of Korea ob_127048 - 201-36, Geumpyeong-gil, Haeri-myeon, Gochang-gun, Jeollabuk-do, Republic of Korea ob_127049 - 78, Sangsa-ro, Galmal-eup, Cheorwon-gun, Gangwon-do, Republic of Korea ob_127050 - 33-13, Bongganggasul-ro 358beon-gil, Daesan-myeon, Uichang-gu, Changwon-si, Gyeongsangnam-do, Republic of Korea ob_127051 - 17, Geumgang-ro 2223beon-gil, Naechon-myeon, Pocheon-si, Gyeonggi-do, Republic of Korea ob_127052 - 526, Gayeong-ro, Yeongjung-myeon, Pocheon-si, Gyeonggi-do, Republic of Korea ob_127053 - 62-2, Ganghwadong-ro 726beon-gil, Bureun-myeon, Ganghwa-gun, Incheon, Republic of Korea ob_127054 - 30-99, Yonghyeon 1-gil, Buan-myeon, Gochang-gun, Jeollabuk-do, Republic of Korea ob_127055 - 291-16, Imjaseo-gil, Imja-myeon, Sinan-gun, Jeollanam-do, Republic of Korea ob_127056 - 64, Hapo-gil, Ugang-myeon, Dangjin-si, Chungcheongnam-do, Republic of Korea ob_127057 - 324-6, Wolgye-ri, Buseok-myeon, Seosan-si, Chungcheongnam-do, Republic of Korea ob_127058 - 352-1, Sagi-ri, Gobuk-myeon, Seosan-si, Chungcheongnam-do, Republic of Korea ob_127059 - 51, Dongmak 2-gil, Inji-myeon, Seosan-si, Chungcheongnam-do, Republic of Korea ob_127075 - 94-4, Doseongeunburi-gil, Jigok-myeon, Seosan-si, Chungcheongnam-do, Republic of Korea ob_127376 - 144, Mowol-ri, Inji-myeon, Seosan-si, Chungcheongnam-do, Republic of Korea ob_127375 - 16-12, Habu-gil, Haeri-myeon, Gochang-gun, Jeollabuk-do, Republic of Korea ob_127374 - 66-25, Yadang 1-gil, Inji-myeon, Seosan-si, Chungcheongnam-do, Republic of Korea ob_127373 - 748-57, Geumgangbyeon-ro, Cheongnam-myeon, Cheongyang-gun, Chungcheongnam-do, Republic of Korea ob_127372 - 504-8, Muhak-ro, Buseok-myeon, Seosan-si, Chungcheongnam-do, Republic of Korea ob_127371 - 8, Samdong-gil, Godae-myeon, Dangjin-si, Chungcheongnam-do, Republic of Korea ob_127370 - 234-77, Unsalli-gil, Daesan-eup, Seosan-si, Chungcheongnam-do, Republic of Korea ob_127369 - 333, Geonbongsa-ro, Ganseong-eup, Goseong-gun, Gangwon-do, Republic of Korea ob_127368 - 30, Aneumgol-gil, Judeok-eup, Chungju-si, Chungcheongbuk-do, Republic of Korea ob_127367 - 49-45, Samdong-gil, Godae-myeon, Dangjin-si, Chungcheongnam-do, Republic of Korea ob_127366 - 481-22, Sinpyeong-ro, Sinpyeong-myeon, Dangjin-si, Chungcheongnam-do, Republic of Korea ob_127365 - 60, Geonpyeong-ro, Yangdo-myeon, Ganghwa-gun, Incheon, Republic of Korea ob_127364 - 34, Dongmak 2-gil, Inji-myeon, Seosan-si, Chungcheongnam-do, Republic of Korea ob_127555 - Bangchuk-ri, Haeri-myeon, Gochang-gun, Jeollabuk-do, Republic of Korea ob_127554 - Gojeonyedong-gil, Simwon-myeon, Gochang-gun, Jeollabuk-do, Republic of Korea ob_127553 - Nokdu-ro, Mujang-myeon, Gochang-gun, Jeollabuk-do, Republic of Korea ob_127552 - Palgyeol-ro, Ochang-eup, Cheongwon-gu, Cheongju-si, Chungcheongbuk-do, Republic of Korea ob_127550 - Yongam 2-gil, Nongso-myeon, Gimcheon-si, Gyeongsangbuk-do, Republic of Korea ob_127548 - Gojeon-ro, Simwon-myeon, Gochang-gun, Jeollabuk-do, Republic of Korea ob_127545 - Myeongsasimni-ro, Sangha-myeon, Gochang-gun, Jeollabuk-do, Republic of Korea ob_127544 - Geumpyeong-gil, Haeri-myeon, Gochang-gun, Jeollabuk-do, Republic of Korea ob_127543 - Sojeonggu-gil, Sojeong-myeon, Sejong-si, Republic of Korea ob_127541 - Maenamgusul-gil, Judeok-eup, Chungju-si, Chungcheongbuk-do, Republic of Korea ob_127556 - Samchung-ro, Buyeo-eup, Buyeo-gun, Chungcheongnam-do, Republic of Korea ob_127557 - Gangnamjangdu-gil, Mujang-myeon, Gochang-gun, Jeollabuk-do, Republic of Korea ob_127558 - Huieojae-ro, Asan-myeon, Gochang-gun, Jeollabuk-do, Republic of Korea ob_127911 - Jinbyeon-ri, Gyuam-myeon, Buyeo-gun, Chungcheongnam-do, Republic of Korea ob_127912 - Gwanchonbanghyeon-gil, Gwanchon-myeon, Imsil-gun, Jeollabuk-do, Republic of Korea ob_127913 - Gagok-ri, Ochang-eup, Cheongwon-gu, Cheongju-si, Chungcheongbuk-do, Republic of Korea ob_127914 - Gwangseung-ri, Haeri-myeon, Gochang-gun, Jeollabuk-do, Republic of Korea WAHIS WAHIS Plateforme de formation Contact FAQ OMSA Site institutionnel Carrières RÉGIONS Afrique Amériques Asie et Pacifique Europe Moyen-Orient NOUS SUIVRE Termes et conditions d’utilisation Politique de confidentialité Politique de cookies Copyright © Organisation mondiale de la santé animale 2023 Préférences en matière de gestion des cookies L’OMSA utilise des cookies pour mesurer le trafic sur son site web et analyser ses performances. Vous pouvez accepter l'utilisation de cookies en cliquant sur ""J'accepte"" ou refuser ces cookies en cliquant sur ""Je refuse"". Cependant, si vous refusez certains cookies, cela pourrait affecter votre expérience de navigation. Consultez notre Politique de confidentialité pour en savoir plus. En savoir plus (https://www.woah.org/fr/politique-de-confidentialite/) Préférences pour tous les services J'accepte Je refuse Mesure de l'audience Google Analytics En savoir plus (https://www.woah.org/fr/politique-de-confidentialite/) J'accepte Je refuse Facebook X LinkedIn Instagram Youtube Flickr Accès autorisé",français,13050,1516,2023-10-19,USA,Dermatose Nodulaire Contagieuse (LSD),site officiel,WAHIS ACCUEIL keyboard_double_arrow_right keyboard_backspace Retour au tableau de bord Corée (Rép. de) - Dermatose nodulaire contagieuse (Inf.,WAHIS ACCUEIL keyboard_double_arrow_right keyboard_backspace Retour au tableau de bord Corée (Rép. de) - Dermatose nodulaire contagieuse (Inf. par le virus de la) - Rapport de suivi 9 [FINAL] INFORMATIONS GÉNÉRALES PAYS / TERRITOIRE OU ZONE PAYS/TERRITOIRE TYPE D'ANIMAL TERRESTRE CATÉGORIE DE MALADIE Maladie de la liste IDENTIFIANT ÉVÉNEMENT 5290 MALADIE Dermatose nodulaire contagieuse (Inf.,WAHIS ACCUEIL keyboard_double_arrow_right keyboard_backspace Retour au tableau de bord Corée (Rép. de) - Dermatose nodulaire contagieuse (Inf. par le virus de la) - Rapport de suivi 9 [FINAL] INFORMATIONS GÉNÉRALES PAYS / TERRITOIRE OU ZONE PAYS/TERRITOIRE TYPE D'ANIMAL TERRESTRE CATÉGORIE DE MALADIE Maladie de la liste IDENTIFIANT ÉVÉNEMENT 5290 MALADIE Dermatose nodulaire contagieuse (Inf.,bovins;APQA;OMS;WOAH;Ministry
code164,https://lc.cx/4RWWSk,Tuberculose : surveillance renforcée pour les bovins importés d’Irlande du Nord,"Tuberculose bovine : surveillance renforcée des animaux importés d'Irlande du Nord Accueil Élevage Santé et bien-être animal Maladies animales Tuberculose : surveillance renforcée pour les bovins importés d’Irlande du Nord À la suite d’un foyer français de tuberculose en lien avec l’introduction d’un bovin provenant d’Irlande du Nord, le ministère de l’Agriculture met en place un protocole de surveillance renforcée appliqué aux bovins importés de ce pays. JE M'ABONNE Publié le 23/10/2023, Mis à jour le 27/10/2023 Partager Lire plus tard Vous devez vous connecter pour ajouter cet article à vos favoris La France Agricole Connectez-vous pour mettre cet article en favoris. Me connecter Non merci Déjà abonné ? Je me connecte En cas d'introduction de bovins vivants en France depuis l’Irlande du Nord, un arrêté préfectoral de mise sous surveillance (APMS) sera rédigé afin de « mettre en œuvre des mesures d’isolement et de contrôle à destination, le temps de vérifier si le bovin est atteint de tuberculose ». © Cédric Faimali/GFA Le ministère de l’Agriculture serre la vis à l’égard des bovins en provenance de l’Irlande du Nord. Dans une instruction technique publiée le 12 octobre 2023 , il détaille les modalités de surveillance renforcée appliquées aux bovins introduits d’Irlande du Nord. Et pour cause : le 13 juillet 2023, « un foyer de tuberculose a été déclaré dans un élevage situé sur la commune d’Hémevez (Manche) à la suite de la confirmation de l’infection sur un bovin né en Irlande du Nord, puis introduit en France en 2017 », rapporte l’instruction. La tuberculose bovine, un fléau pour la filière britannique (02/06/2023) Isolement et dépistage Pour mettre en place cette surveillance renforcée, une vérification des mouvements d’introduction de bovins vivants en France depuis l’Irlande du Nord sera réalisée via le logiciel TRACES NT par les directions départementales de l’emploi, du travail, des solidarités et de la protection des populations. (DD (ETS) PP). Le cas échéant, un arrêté préfectoral de mise sous surveillance (APMS) sera rédigé afin de « mettre en œuvre des mesures d’isolement et de contrôle à destination, le temps de vérifier si le bovin est atteint de tuberculose ». Les frais de ces mesures sont « à la charge du propriétaire, du destinataire, de l’expéditeur ou, à défaut, de tout opérateur intervenant dans l’introduction de bovins originaires d’Irlande du Nord sur le territoire métropolitain ». Tuberculose bovine : l’indemnisation pour les abattages diagnostics revalorisés (12/04/2023) Par Vincent Guyot Sur le même thème Grippe aviaire : renforcement des mesures de lutte dans 4 départements Les foyers de grippe aviaire se multiplient dans les élevages français Grippe aviaire : l’État débloque 4 millions d’euros pour les éleveurs touchés Matériels d'occasion Plusieurs milliers d'annonces de matériels agricoles d'occasion Emploi Trouver un emploi, recruter, se former : Retrouvez toutes les offres de la filière agricole Éditions L'éditeur du monde agricole Des livres pour récolter le succès Ce service est réservé à nos abonnés La France Agricole Pour profiter de tous nos services, découvrez vite nos offres d'abonnement. Je découvre les offres > Déjà abonné ? Je me connecte",français,3238,508,23-10-2023,France,Tuberculose,médias,"Tuberculose bovine : surveillance renforcée des animaux importés d'Irlande du Nord Accueil Élevage Santé et bien-être animal Maladies animales Tuberculose : surveillance renforcée pour les bovins importés d’Irlande du Nord À la suite d’un foyer français de tuberculose en lien avec l’introduction d’un bovin provenant d’Irlande du Nord, le ministère","Tuberculose bovine : surveillance renforcée des animaux importés d'Irlande du Nord Accueil Élevage Santé et bien-être animal Maladies animales Tuberculose : surveillance renforcée pour les bovins importés d’Irlande du Nord À la suite d’un foyer français de tuberculose en lien avec l’introduction d’un bovin provenant d’Irlande du Nord, le ministère de l’Agriculture met en place un protocole de surveillance renforcée appliqué aux bovins importés de ce pays.","Tuberculose bovine : surveillance renforcée des animaux importés d'Irlande du Nord Accueil Élevage Santé et bien-être animal Maladies animales Tuberculose : surveillance renforcée pour les bovins importés d’Irlande du Nord À la suite d’un foyer français de tuberculose en lien avec l’introduction d’un bovin provenant d’Irlande du Nord, le ministère de l’Agriculture met en place un protocole de surveillance renforcée appliqué aux bovins importés de ce pays. JE M'ABONNE Publié le 23/10/2023, Mis à jour le 27/10/2023 Partager Lire plus tard Vous devez vous connecter pour ajouter cet article à vos favoris La France Agricole Connectez-vous pour mettre cet article en favoris.",ministère;bovins
code165,https://lc.cx/shm7ON,La Corée du Sud signale 4 nouveaux cas de dermatose nodulaire contagieuse,"La Corée du Sud signale 4 nouveaux cas de dermatose nodulaire contagieuse | AGENCE DE PRESSE YONHAP Go to Contents Go to Navigation Notre site utilise des cookies et d'autres techniques pour offrir une meilleure qualité de service. En continuant à visiter le site, vous acceptez l'usage de ces techniques et notre politique. Voir en détail close Accepter Facebook X More Pinterest Linked in Tumblr Reddit Facebook Messenger Copy URL L’URL a été copîé Confirmer Le ministre de l'Agriculture, de l'Alimentation et des Affaires rurales Chung Hwang-keun prend la parole lors d'un audit à l'Assemblée nationale, le lundi 23 octobre 2023. SEOUL, 23 oct. (Yonhap) -- La Corée du Sud a rapporté de nouveaux cas de dermatose nodulaire contagieuse (DNC) sur fond d'inquiétudes sur une éventuelle propagation à l'échelle nationale de cette maladie hautement transmissible, a fait savoir ce lundi le ministère de l'Agriculture, de l'Alimentation et des Affaires rurales. «Il y a 14 cas d'infection et 638 têtes de bétail ont été abattues jusqu'à présent», a déclaré le ministre de l'Agriculture Chung Hwang-keun lors d'un audit à l'Assemblée nationale. Aujourd'hui, deux cas supplémentaires ont été signalés dans la province du Chungcheong du Sud alors que le Gyeonggi et le Chungcheong du Nord ont rapporté chacun un cas. Le pays a confirmé vendredi dernier ses tout premiers cas de DNC dans le Chungcheong du Sud. «Le nombre de cas confirmés continuera à augmenter», a prévenu Chung. La DNC est une maladie animale s'accompagnant de fièvre, de nodules sur la peau et d'anorexie. Transmise par des insectes hématophages, cette maladie contagieuse touche principalement les bovins et est rarement mortelle chez l'homme. Actuellement, tous les bétails des fermes infectées sont en train d'être abattus. «Si nous ne procédons pas à un abattage dans les fermes infectées, la maladie pourra se propager vers d'autres domaines dont le réseau du commerce de détail», a averti Chung en assurant que les exploitants affectés seront entièrement dédommagés. lsr@yna.co.kr (FIN) Mots clés #dnc Mots clés de l’actualité Les plus lus Lee rencontre Macron en marge du G20 et évoque un partenariat stratégique avec la France Cérémonie du corps des Marines pour l'anniversaire de l'attaque nord-coréenne contre l'île de Yeongpyeong Lee s'est entretenu avec Modi et Lula en marge du sommet du G20 Les exportations annuelles d'algues séchées coréennes atteignent pour la 1ère fois 1 Md de dollars Lee demande à Merz de pouvoir apprendre de l'expérience allemande de la réunification more Les photos les plus vues Avec le chancelier fédéral d'Allemagne Intervention de Lee En plein automne Saison de ski more Vidéos 00:57 Lee s'est entretenu avec Modi et Lula en marge du sommet du G20 more prev La Corée du Sud signale 4 nouveaux cas de dermatose nodulaire contagieuse Next La Corée du Sud signale 4 nouveaux cas de dermatose nodulaire contagieuse Articles à la Une Lee rencontre Macron en marge du G20 et évoque un partenariat stratégique avec la France Sommet du G20 : Lee invite la communauté internationale à donner un nouveau souffle à l'OMC Lee s'est entretenu avec Modi et Lula en marge du sommet du G20 Sommet du G20 : Lee s'apprête à présenter son plan de coopération mondiale sur l'IA Les exportations annuelles d'algues séchées coréennes atteignent pour la 1ère fois 1 Md de dollars Cérémonie du corps des Marines pour l'anniversaire de l'attaque nord-coréenne contre l'île de Yeongpyeong Accueil Actualités Accueil Haut de page",français,3509,564,23-10-2023,France,Dermatose Nodulaire Contagieuse (LSD),médias,La Corée du Sud signale 4 nouveaux cas de dermatose nodulaire contagieuse | AGENCE DE PRESSE YONHAP Go to Contents Go to Navigation Notre site utilise des cookies et d'autres techniques pour offrir une meilleure qualité de service.,"La Corée du Sud signale 4 nouveaux cas de dermatose nodulaire contagieuse | AGENCE DE PRESSE YONHAP Go to Contents Go to Navigation Notre site utilise des cookies et d'autres techniques pour offrir une meilleure qualité de service. En continuant à visiter le site, vous acceptez l'usage de ces techniques et notre politique.","La Corée du Sud signale 4 nouveaux cas de dermatose nodulaire contagieuse | AGENCE DE PRESSE YONHAP Go to Contents Go to Navigation Notre site utilise des cookies et d'autres techniques pour offrir une meilleure qualité de service. En continuant à visiter le site, vous acceptez l'usage de ces techniques et notre politique. Voir en détail close Accepter Facebook X More Pinterest Linked in Tumblr Reddit Facebook Messenger Copy URL L’URL a été copîé Confirmer Le ministre de l'Agriculture, de l'Alimentation et des Affaires rurales Chung Hwang-keun prend la parole lors d'un audit à l'Assemblée nationale, le lundi 23 octobre 2023. SEOUL, 23 oct. (Yonhap) -- La Corée du Sud a rapporté de nouveaux cas de dermatose nodulaire contagieuse (DNC) sur fond d'inquiétudes sur une éventuelle propagation à l'échelle nationale de cette maladie hautement transmissible, a fait savoir ce lundi le ministère de l'Agriculture, de l'Alimentation et des Affaires rurales.",ministère;bovins
code166,https://lc.cx/z0ursw,ERREUR: Contenu insuffisant,,N/A,0,0,N/A,N/A,N/A,N/A,,,,
