code,url,titre,contenu,langue,nb_caracteres,nb_mots,date_publication,lieu,maladie,source_type,resume_50,resume_100,resume_150,entites_nommees
code151,https://lc.cx/nKVbsM,Bluetongue virus was detected in Europe,"Bluetongue virus was detected in Europe News Bluetongue virus was detected in Europe Lamb Meat Belgium Other Policies Germany +6 Published Oct 16, 2023 Tridge summary The bluetongue virus has been detected in Germany after previously being found in the Netherlands and Belgium. The virus was diagnosed in a sheep on a farm near the Dutch border, leading to quarantine measures. The virus, which mainly affects cattle, sheep, and goats, is spread by midges and causes severe symptoms in sheep. Disclaimer: The above summary was generated by Tridge's proprietary AI model for informational purposes. Original content After the Netherlands and Belgium, the bluetongue virus was also detected in Germany. The competent authorities diagnosed the disease in a sheep on a farm near the Dutch border. According to the tests, the other animals on the farm show no signs of illness, regardless of this, quarantine was ordered. The disease causes serious economic damage in the region, as North Rhine-Westphalia loses its disease-free status - and this means trade restrictions in relation to animal species susceptible to bluetongue. The first cases of the current wave were detected in August on sheep farms in Spain, and then discovered by the Dutch authorities at the beginning of September. Typically, the presence of the virus was detected on sheep farms, and today nearly 40 livestock farms are affected in North Holland and the province of Utrecht. However, animals have already tested positive for the virus on some cattle farms. The virus serotype 3 is responsible for the disease in the region, which produces ... Source: Agraragazat Would you like more in-depth insights? Gain access to detailed market analysis tailored to your business needs. Contact us to learn more Related market data Curation March, 2025 Export market for Frozen Bone-in Beef Cut in Netherlands 25 export price data Curation March, 2024 Export market for Frozen Bone-in Beef Cut in Spain 20 export price data What to read next News The producer Marco van Strien found a ""frothy"" market for his agroecological barley: Proud, he assures that Bichos de campo · Nov 22, 2025 News Rice planting advances in the South and rains should maintain pace in the North-Central region CanalRural · Nov 22, 2025 News Dry climate in Matopiba does not reduce soybean production estimate in Brazil CanalRural · Nov 22, 2025 News Can it go up? A large wheat harvest and the question about the future of prices Agromeat · Nov 23, 2025 News Breeding season: the secret of nutrition that guarantees conception and heavy calf CanalRural · Nov 22, 2025 Read more relevant content Report September 2025 Outlook Report: Coffee, Sugar, Tea, and Cocoa Victor Langat · Sep 26, 2025 Report September 2025 Outlook Report: Meat Victor Langat · Sep 26, 2025 Opinion US Apple Market Faces Record Harvest and Mounting Headwinds Bojan Mijatovic · Sep 5, 2025 Opinion Ecuador's Tango Mandarins Make Their US Debut After Five-Year Negotiation Bojan Mijatovic · Aug 29, 2025 Opinion Typhoon Kajiki’s Impact on Vietnamese Agriculture: Localized Rice Losses, Limited Coffee Disruption Mzingaye Ndubiwa · Aug 28, 2025 Opinion Impact of US Tariffs on EU Agriculture: Sectoral Impacts and Strategic Responses Benjamin Lategan · Aug 22, 2025 Opinion US Tariffs on Brazilian Seafood Ripple Through the Supply Chain Bojan Mijatovic · Aug 22, 2025 Report August 2025 Outlook Report: Oils Xchel Perez · Aug 22, 2025 By clicking “Accept Cookies,” I agree to provide cookies for statistical and personalized preference purposes. To learn more about our cookies, please read our Privacy Policy. Accept Cookies Accept Cookies Learn More",anglais,3657,590,01-01-2025,Espagne,Fièvre Catarrhale / Bluetongue,médias,"Bluetongue virus was detected in Europe News Bluetongue virus was detected in Europe Lamb Meat Belgium Other Policies Germany +6 Published Oct 16, 2023 Tridge summary The bluetongue virus has been detected in Germany after previously being found in the Netherlands and Belgium.","Bluetongue virus was detected in Europe News Bluetongue virus was detected in Europe Lamb Meat Belgium Other Policies Germany +6 Published Oct 16, 2023 Tridge summary The bluetongue virus has been detected in Germany after previously being found in the Netherlands and Belgium. The virus was diagnosed in a sheep on a farm near the Dutch border, leading to quarantine measures. The virus, which mainly affects cattle, sheep, and goats, is spread by midges and causes severe symptoms in sheep. Disclaimer: The above summary was generated by Tridge's proprietary AI model for informational purposes.","Bluetongue virus was detected in Europe News Bluetongue virus was detected in Europe Lamb Meat Belgium Other Policies Germany +6 Published Oct 16, 2023 Tridge summary The bluetongue virus has been detected in Germany after previously being found in the Netherlands and Belgium. The virus was diagnosed in a sheep on a farm near the Dutch border, leading to quarantine measures. The virus, which mainly affects cattle, sheep, and goats, is spread by midges and causes severe symptoms in sheep. Disclaimer: The above summary was generated by Tridge's proprietary AI model for informational purposes. Original content After the Netherlands and Belgium, the bluetongue virus was also detected in Germany. The competent authorities diagnosed the disease in a sheep on a farm near the Dutch border. According to the tests, the other animals on the farm show no signs of illness, regardless of this, quarantine was ordered.",cattle;OMS
code152,https://lc.cx/sXWRhi,Bluetongue officially confirmed in Germany,"Bluetongue officially confirmed in Germany News Bluetongue officially confirmed in Germany Frozen Bone-In Beef Meat Germany Other Policies Supply +2 Published Oct 17, 2023 Tridge summary An individual animal on a farm in North Rhine-Westphalia, Germany has been affected by bluetongue, a disease that causes no symptoms in other animals. As a result, the entire state loses its bluetongue-free status and trade in vulnerable cattle is only allowed under certain conditions. The outbreak was not a surprise, as there is already a major outbreak in the Netherlands, and more infections are expected in North Rhine-Westphalia and Lower Saxony. Disclaimer: The above summary was generated by Tridge's proprietary AI model for informational purposes. Original content For the time being, it concerns an individual animal on the farm. The other animals show no symptoms, the North Rhine-Westphalia Ministry of Agriculture reports. The affected company is blocked and is not allowed to bring in or take out animals. Bluetongue in Germany no surprise Due to the outbreak, the entire state loses its bluetongue-free status. Trade in cattle that are sensitive to bluetongue from the area is only allowed under certain conditions. Germany, Belgium and the Netherlands are discussing this. Transport of livestock directly to slaughter is possible. The German reference laboratory FLI is not surprised about the contamination of bluetongue in Germany, now that there is a major outbreak in the Netherlands. The authorities are anticipating many more infections, especially in North Rhine-Westphalia and Lower Saxony. In the Netherlands, the number of companies with bluetongue has increased to 1,431 official infections. In addition, there are 732 companies that reported ... Source: Boerderij Would you like more in-depth insights? Gain access to detailed market analysis tailored to your business needs. Contact us to learn more Related market data Curation March, 2025 Export market for Frozen Bone-in Beef Cut in Netherlands 25 export price data What to read next News The producer Marco van Strien found a ""frothy"" market for his agroecological barley: Proud, he assures that Bichos de campo · Nov 22, 2025 News Rice planting advances in the South and rains should maintain pace in the North-Central region CanalRural · Nov 22, 2025 News Dry climate in Matopiba does not reduce soybean production estimate in Brazil CanalRural · Nov 22, 2025 News Can it go up? A large wheat harvest and the question about the future of prices Agromeat · Nov 23, 2025 News Breeding season: the secret of nutrition that guarantees conception and heavy calf CanalRural · Nov 22, 2025 Read more relevant content Report September 2025 Outlook Report: Coffee, Sugar, Tea, and Cocoa Victor Langat · Sep 26, 2025 Report September 2025 Outlook Report: Meat Victor Langat · Sep 26, 2025 Opinion US Apple Market Faces Record Harvest and Mounting Headwinds Bojan Mijatovic · Sep 5, 2025 Opinion Ecuador's Tango Mandarins Make Their US Debut After Five-Year Negotiation Bojan Mijatovic · Aug 29, 2025 Opinion Typhoon Kajiki’s Impact on Vietnamese Agriculture: Localized Rice Losses, Limited Coffee Disruption Mzingaye Ndubiwa · Aug 28, 2025 Opinion Impact of US Tariffs on EU Agriculture: Sectoral Impacts and Strategic Responses Benjamin Lategan · Aug 22, 2025 Opinion US Tariffs on Brazilian Seafood Ripple Through the Supply Chain Bojan Mijatovic · Aug 22, 2025 Report August 2025 Outlook Report: Oils Xchel Perez · Aug 22, 2025 By clicking “Accept Cookies,” I agree to provide cookies for statistical and personalized preference purposes. To learn more about our cookies, please read our Privacy Policy. Accept Cookies Accept Cookies Learn More",anglais,3711,582,01-01-2025,Allemagne,Fièvre Catarrhale / Bluetongue,médias,"Bluetongue officially confirmed in Germany News Bluetongue officially confirmed in Germany Frozen Bone-In Beef Meat Germany Other Policies Supply +2 Published Oct 17, 2023 Tridge summary An individual animal on a farm in North Rhine-Westphalia, Germany has been affected by bluetongue, a disease that causes no symptoms in other animals.","Bluetongue officially confirmed in Germany News Bluetongue officially confirmed in Germany Frozen Bone-In Beef Meat Germany Other Policies Supply +2 Published Oct 17, 2023 Tridge summary An individual animal on a farm in North Rhine-Westphalia, Germany has been affected by bluetongue, a disease that causes no symptoms in other animals. As a result, the entire state loses its bluetongue-free status and trade in vulnerable cattle is only allowed under certain conditions. The outbreak was not a surprise, as there is already a major outbreak in the Netherlands, and more infections are expected in North Rhine-Westphalia and Lower Saxony.","Bluetongue officially confirmed in Germany News Bluetongue officially confirmed in Germany Frozen Bone-In Beef Meat Germany Other Policies Supply +2 Published Oct 17, 2023 Tridge summary An individual animal on a farm in North Rhine-Westphalia, Germany has been affected by bluetongue, a disease that causes no symptoms in other animals. As a result, the entire state loses its bluetongue-free status and trade in vulnerable cattle is only allowed under certain conditions. The outbreak was not a surprise, as there is already a major outbreak in the Netherlands, and more infections are expected in North Rhine-Westphalia and Lower Saxony. Disclaimer: The above summary was generated by Tridge's proprietary AI model for informational purposes. Original content For the time being, it concerns an individual animal on the farm. The other animals show no symptoms, the North Rhine-Westphalia Ministry of Agriculture reports.",cattle;Ministry;OMS
code153,https://lc.cx/JSB3wp,DAERA urges farmers to be vigilant for bluetongue and EHD,"DAERA urges farmers to be vigilant for bluetongue and EHD - Agriland.ie Latest News Beef Dairy Sheep Tillage Machinery Northern Ireland Videos Podcasts DAERA urges farmers to be vigilant for bluetongue and EHD By Aisling O'Brien October 18, 2023 9:30 AM Share this article The Department of Agriculture, Environment and Rural Affairs (DAERA) is urging farmers to be vigilant for signs of bluetongue and Epizootic Haemorrhagic Disease (EHD). The warning follows the confirmation of EHD in France, and the recent spread of bluetongue (BTV) across Europe. EHD was confirmed for the first time in Europe in October 2022 in Italy. It has since spread to Portugal, Spain, before reaching France. The disease affects deer most severely, but clinical cases have been reported in cattle at multiple farms in these countries. Several strains of BTV have been circulating in Europe, with nearly 800 outbreaks confirmed. The Netherlands reported their first outbreak of BTV since 2009 in September, followed by the Belgium authorities in October. Last month, French authorities confirmed the presence of a new strain of the disease, BTV-8, which is causing more severe clinical signs in cattle and sheep. DAERA DAERA is advising farmers to carefully consider the disease risks associated with sourcing animals from areas in mainland Europe where the viruses have been detected. The department added that imported animals found to be infected with BTV will be slaughtered. In addition, no compensation will be paid, and movement restrictions will be placed on the holding for several months while extensive surveillance is carried out to rule out further spread. Housing and isolation of imported pregnant animals will also be required until the birth of the progeny, which must be tested with negative results before restrictions will be lifted. Northern Ireland’s chief veterinary officer (CVO), Dr. Robert Huey said as both bluetongue and EHD are windborne vector diseases transmitted through midges, the main risk for Northern Ireland is the importation of infected animals. “This was the case in December 2018, when the last detection of BTV was discovered in Northern Ireland, as part of the department’s routine post-import testing regime,"" Dr. Huey said. ""The disease was detected in a heifer imported from France to a holding in Northern Ireland. “I would strongly encourage farmers to follow the DAERA guidance and to be aware of the significant risks and the potentially adverse consequences, both for themselves and for the industry, of importing animals from, or transiting through affected areas. “An incursion of bluetongue or Epizootic Haemorrhagic Disease to Northern Ireland would result in the loss of disease-free status which would be devastating for the industry, he added. Farmers DAERA has offered the following advice to farmers: Anyone who imports animals from a bluetongue affected area must ensure that the animals have been vaccinated against the disease prior to import; If the animals are pregnant, the vaccination must have been carried out so that the animal was immune before mating; These are legal requirements and conditions must be attested to by the certifying official veterinarian on the health certificate; Farmers should also consider seeking additional guarantees from the seller such as a pre-export test to prove effective immunity; If you choose to bring animals into Northern Ireland from a disease-free zone via a bluetongue infected zone you must ensure you comply with all the conditions on the export health certificate. This should include the treatment of animals and vehicles with an approved insecticide and ensuring all parts of the health certificate for the imported animals have been met. Bluetongue affects all ruminants, such as cattle, goats, deer and sheep. Symptoms may include: Fever; swelling of the head and neck; lameness; inflammation of the mucous membranes of the mouth, nose and eyes; drooling; and there is often a high mortality rate. EHD affects deer most severely, but clinical cases have been reported in cattle at multiple farms in affected European countries. Topics Animal Health Bluetongue Cattle DAERA Disease EHD Northern Ireland Sheep Share this article More Stories Rural Life about 2 years ago Tánaiste launches new Shared Island Project for rural communities Tánaiste and Minister for Foreign Affairs, Micheál Martin launched a new Shared Island Project... Environment about 2 years ago ACRES: Progress continues on assessment of commonages The assessment of commonages under the Agri-Climate Rural Environment Scheme (ACRES) has continued... Sponsored Cryptosporidiosis vaccine delivers for Roscommon dairy farmer Tommie Devine runs a 170-cow Jersey-cross herd across 400ac with his father Thomas, outside...",anglais,4784,740,01-01-2025,France,Fièvre Catarrhale / Bluetongue,médias,DAERA urges farmers to be vigilant for bluetongue and EHD - Agriland.,"DAERA urges farmers to be vigilant for bluetongue and EHD - Agriland.ie Latest News Beef Dairy Sheep Tillage Machinery Northern Ireland Videos Podcasts DAERA urges farmers to be vigilant for bluetongue and EHD By Aisling O'Brien October 18, 2023 9:30 AM Share this article The Department of Agriculture, Environment and Rural Affairs (DAERA) is urging farmers to be vigilant for signs of bluetongue and Epizootic Haemorrhagic Disease (EHD). The warning follows the confirmation of EHD in France, and the recent spread of bluetongue (BTV) across Europe. EHD was confirmed for the first time in Europe in October 2022 in Italy.","DAERA urges farmers to be vigilant for bluetongue and EHD - Agriland.ie Latest News Beef Dairy Sheep Tillage Machinery Northern Ireland Videos Podcasts DAERA urges farmers to be vigilant for bluetongue and EHD By Aisling O'Brien October 18, 2023 9:30 AM Share this article The Department of Agriculture, Environment and Rural Affairs (DAERA) is urging farmers to be vigilant for signs of bluetongue and Epizootic Haemorrhagic Disease (EHD). The warning follows the confirmation of EHD in France, and the recent spread of bluetongue (BTV) across Europe. EHD was confirmed for the first time in Europe in October 2022 in Italy. It has since spread to Portugal, Spain, before reaching France. The disease affects deer most severely, but clinical cases have been reported in cattle at multiple farms in these countries. Several strains of BTV have been circulating in Europe, with nearly 800 outbreaks confirmed.",cattle;WHO;OMS
code154,https://lc.cx/fnYicq,ERREUR: Contenu insuffisant,Redirecting...,N/A,14,0,N/A,N/A,N/A,N/A,,,,
code155,https://lc.cx/V_Nr3n,اقتصاد,"لحوم..""أونسا"" تتابع عن كثب انتشار فيروس يهدد القطعان بأوروبا لحوم..""أونسا"" تتابع عن كثب انتشار فيروس يهدد القطعان بأوروبا ● الأربعاء 18 أكتوبر 2023 ● يشارك بعد موجة بق الفراش، ترزح العديد من الدول الأوربية حاليا، لاسيما فرنسا تحت مرض آخر يعصف بالقطعان. يتعلق الأمر بمرض النزف الوبائي بين القطعان الذي أعلن عن أولى حالات هذا المرض منذ شهر شتنبر 2023، قبل أن يتفشى بشكل مقلق لدرجة أن فرنسا، أحصت 453 حالة بمختلف مزارع البلاد. هذا الخطر استنفر المكتب الوطني للسلامة الصحية للنتجات الغذائية ""أونسا"" الذي يراقب تطورات انتشار الفيروس بهذه الدول، خصوصا أن المغرب مازال يستورد الأبقار والعجول والأغنام لسد الفجوة بين الطلب والعرض في أسواق المملكة. للإشارة، فإن هذا المرض الحيواني له علامات سريرية مشابهة لأعراض «مرض اللسان الأزرق»، بما في ذلك الحمى وفقدان الوزن وجروح الفم وصعوبات التنفس، لكن مع معدل وفيات منخفض جدا، وحتى اليوم لا يوجد لقاح ضد هذا المرض. لكن المكتب الوطني للسلامة الصحية للمنتجات الغذائية مافتئ يؤكد أن جميع الحيوانات الحية المستوردة تخضع لرقابة صارمة ومنتظمة على مستوى مراكز التفتيش على الحدود، من خلال فحص حالتها الصحية و التحقق من الشهادات والوثائق الصحية وإجراء الفحوصات اللازمة لتحديد الحالة الصحية للقطيع فيما يتعلق ببعض الأمراض الحيوانية المعدية. بعد ذلك،يصدر المفتش البيطري في أونسا شهادة صحية للقبول يضيف المكتب الوطني للسلامة الصحية للمنتجات الغذائية، ثم يسمح فقط للحيوانات السليمة بدخول الأراضي المغربية.",arabe,1325,216,01-01-2025,Maroc,Fièvre Catarrhale / Bluetongue,médias,"لحوم..""أونسا"" تتابع عن كثب انتشار فيروس يهدد القطعان بأوروبا لحوم..""أونسا"" تتابع عن كثب انتشار فيروس يهدد القطعان بأوروبا ● الأربعاء 18 أكتوبر 2023 ● يشارك بعد موجة بق الفراش، ترزح العديد من الدول الأوربية حاليا، لاسيما فرنسا تحت مرض آخر يعصف بالقطعان.","لحوم..""أونسا"" تتابع عن كثب انتشار فيروس يهدد القطعان بأوروبا لحوم..""أونسا"" تتابع عن كثب انتشار فيروس يهدد القطعان بأوروبا ● الأربعاء 18 أكتوبر 2023 ● يشارك بعد موجة بق الفراش، ترزح العديد من الدول الأوربية حاليا، لاسيما فرنسا تحت مرض آخر يعصف بالقطعان. يتعلق الأمر بمرض النزف الوبائي بين القطعان الذي أعلن عن أولى حالات هذا المرض منذ شهر شتنبر 2023، قبل أن يتفشى بشكل مقلق لدرجة أن فرنسا، أحصت 453 حالة بمختلف مزارع البلاد.","لحوم..""أونسا"" تتابع عن كثب انتشار فيروس يهدد القطعان بأوروبا لحوم..""أونسا"" تتابع عن كثب انتشار فيروس يهدد القطعان بأوروبا ● الأربعاء 18 أكتوبر 2023 ● يشارك بعد موجة بق الفراش، ترزح العديد من الدول الأوربية حاليا، لاسيما فرنسا تحت مرض آخر يعصف بالقطعان. يتعلق الأمر بمرض النزف الوبائي بين القطعان الذي أعلن عن أولى حالات هذا المرض منذ شهر شتنبر 2023، قبل أن يتفشى بشكل مقلق لدرجة أن فرنسا، أحصت 453 حالة بمختلف مزارع البلاد. هذا الخطر استنفر المكتب الوطني للسلامة الصحية للنتجات الغذائية ""أونسا"" الذي يراقب تطورات انتشار الفيروس بهذه الدول، خصوصا أن المغرب مازال يستورد الأبقار والعجول والأغنام لسد الفجوة بين الطلب والعرض في أسواق المملكة. للإشارة، فإن هذا المرض الحيواني له علامات سريرية مشابهة لأعراض «مرض اللسان الأزرق»، بما في ذلك الحمى وفقدان الوزن وجروح الفم وصعوبات التنفس، لكن مع معدل وفيات منخفض جدا، وحتى اليوم لا يوجد لقاح ضد هذا المرض.",
